[
  {
    "researcher_name": "Ganesh Jawahar",
    "researcher_title": "Research Scientist at Google DeepMind",
    "researcher_company": "Google DeepMind",
    "linkedin_url": "https://www.linkedin.com/in/ganesh-jawahar-ab928435",
    "google_scholar": "https://scholar.google.com/scholar?q=Ganesh+Jawahar",
    "total_publications": 6,
    "analysis": "## Core Research Domain\nGanesh Jawahar primarily focuses on natural language processing (NLP) with a specialization in improving distributed representations and embeddings for textual data, particularly in social media contexts like tweets.\n\n## Research Expertise\n- **Text Representation Learning**: Developing methods to enhance the representation of textual data, especially in the context of social media and web content.\n- **Cross-domain Content Classification**: Utilizing neural networks to classify web content across different domains.\n- **Temporal and Contextual Analysis**: Incorporating temporal and user context to improve the understanding and representation of social media content.\n- **Author and Document Embeddings**: Creating embeddings that capture both content and structural information, such as author relationships and document structures.\n\n## Key Contributions\n1. **Improving Distributed Representations of Tweets**: Developed methods to enhance the representation of tweets by considering both present and future contexts, which improves the accuracy of tweet analysis and classification.\n2. **Author2Vec**: Introduced a novel approach to learn author representations by combining content and link information, which aids in understanding author influence and relationships in social networks.\n3. **Doc2Sent2Vec**: Proposed a two-phase approach for learning document representations that improves the semantic understanding of documents by breaking them down into sentences and then learning their embeddings.\n\n## Research Cluster\nText Representation & NLP\n\n## Impact Summary\nGanesh Jawahar has significantly contributed to the field of NLP by advancing methods for text representation, particularly in the context of social media. His work on tweet representations and author embeddings has improved the understanding of social media dynamics and author influence. As a Research Scientist at Google DeepMind, his contributions are influential in developing more nuanced and context-aware NLP models, which are crucial for applications in sentiment analysis, content classification, and beyond. His research has been recognized for its innovative approach to integrating temporal and contextual information into text embeddings, making it a valuable asset in the evolving landscape of AI-driven text analysis.",
    "analyzed_at": "2025-11-22T21:43:09.829340",
    "model_used": "gpt-4o",
    "core_domain": "Ganesh Jawahar primarily focuses on natural language processing (NLP) with a specialization in improving distributed representations and embeddings for textual data, particularly in social media contexts like tweets.",
    "expertise_areas": [
      "**Text Representation Learning**: Developing methods to enhance the representation of textual data, especially in the context of social media and web content.",
      "**Cross-domain Content Classification**: Utilizing neural networks to classify web content across different domains.",
      "**Temporal and Contextual Analysis**: Incorporating temporal and user context to improve the understanding and representation of social media content.",
      "**Author and Document Embeddings**: Creating embeddings that capture both content and structural information, such as author relationships and document structures."
    ],
    "key_contributions": [
      "1. **Improving Distributed Representations of Tweets**: Developed methods to enhance the representation of tweets by considering both present and future contexts, which improves the accuracy of tweet analysis and classification.",
      "2. **Author2Vec**: Introduced a novel approach to learn author representations by combining content and link information, which aids in understanding author influence and relationships in social networks.",
      "3. **Doc2Sent2Vec**: Proposed a two-phase approach for learning document representations that improves the semantic understanding of documents by breaking them down into sentences and then learning their embeddings."
    ],
    "research_cluster": "Text Representation & NLP",
    "impact_summary": "Ganesh Jawahar has significantly contributed to the field of NLP by advancing methods for text representation, particularly in the context of social media. His work on tweet representations and author embeddings has improved the understanding of social media dynamics and author influence. As a Research Scientist at Google DeepMind, his contributions are influential in developing more nuanced and context-aware NLP models, which are crucial for applications in sentiment analysis, content classification, and beyond. His research has been recognized for its innovative approach to integrating temporal and contextual information into text embeddings, making it a valuable asset in the evolving landscape of AI-driven text analysis."
  },
  {
    "researcher_name": "Martin Maas",
    "researcher_title": "Senior Staff Research Scientist at Google DeepMind",
    "researcher_company": "Google DeepMind",
    "linkedin_url": "https://www.linkedin.com/in/martinmaas",
    "google_scholar": "https://scholar.google.com/scholar?q=Martin+Maas",
    "total_publications": 10,
    "analysis": "## Core Research Domain\nMartin Maas primarily focuses on the intersection of computer systems and AI, with a specialization in optimizing language runtime systems and garbage collection techniques for distributed and parallel computing environments.\n\n## Research Expertise\n- **Garbage Collection**: Development of advanced garbage collection methods, particularly in distributed systems.\n- **Language Runtime Systems**: Design and coordination of runtime systems for managed-language applications.\n- **Hardware-Software Co-design**: Integration of hardware and software solutions to enhance memory management and computation efficiency.\n- **Parallel Computing**: Techniques for co-scheduling and optimizing parallel runtime systems.\n\n## Key Contributions\n1. **Grail Quest**: Proposed a novel hardware-assisted approach to improve garbage collection efficiency, enhancing performance in managed-language environments.\n2. **Taurus**: Developed a holistic runtime system that coordinates distributed managed-language applications, improving their scalability and performance.\n3. **GhostRider**: Created a hardware-software system designed to facilitate memory trace oblivious computation, enhancing privacy and security in computational processes.\n4. **Callisto**: Innovated in co-scheduling parallel runtime systems, optimizing resource allocation and execution efficiency in multi-core environments.\n\n## Research Cluster\n\"Systems Optimization & Distributed Computing\"\n\n## Impact Summary\nMartin Maas has significantly influenced the field of computer systems through his work on optimizing runtime environments and garbage collection processes. His contributions have advanced the efficiency and scalability of distributed systems, particularly in managed-language applications. His research has been recognized for integrating hardware and software solutions, which has implications for both academic research and practical applications in industry. As a Senior Staff Research Scientist at Google DeepMind, Maas continues to push the boundaries of systems optimization, impacting the development of more efficient and robust AI systems.",
    "analyzed_at": "2025-11-22T21:43:15.899290",
    "model_used": "gpt-4o",
    "core_domain": "Martin Maas primarily focuses on the intersection of computer systems and AI, with a specialization in optimizing language runtime systems and garbage collection techniques for distributed and parallel computing environments.",
    "expertise_areas": [
      "**Garbage Collection**: Development of advanced garbage collection methods, particularly in distributed systems.",
      "**Language Runtime Systems**: Design and coordination of runtime systems for managed-language applications.",
      "**Hardware-Software Co-design**: Integration of hardware and software solutions to enhance memory management and computation efficiency.",
      "**Parallel Computing**: Techniques for co-scheduling and optimizing parallel runtime systems."
    ],
    "key_contributions": [
      "1. **Grail Quest**: Proposed a novel hardware-assisted approach to improve garbage collection efficiency, enhancing performance in managed-language environments.",
      "2. **Taurus**: Developed a holistic runtime system that coordinates distributed managed-language applications, improving their scalability and performance.",
      "3. **GhostRider**: Created a hardware-software system designed to facilitate memory trace oblivious computation, enhancing privacy and security in computational processes.",
      "4. **Callisto**: Innovated in co-scheduling parallel runtime systems, optimizing resource allocation and execution efficiency in multi-core environments."
    ],
    "research_cluster": "\"Systems Optimization & Distributed Computing\"",
    "impact_summary": "Martin Maas has significantly influenced the field of computer systems through his work on optimizing runtime environments and garbage collection processes. His contributions have advanced the efficiency and scalability of distributed systems, particularly in managed-language applications. His research has been recognized for integrating hardware and software solutions, which has implications for both academic research and practical applications in industry. As a Senior Staff Research Scientist at Google DeepMind, Maas continues to push the boundaries of systems optimization, impacting the development of more efficient and robust AI systems."
  },
  {
    "researcher_name": "Kory W. Mathewson",
    "researcher_title": "Staff Research Scientist @ Google DeepMind | Generative AI and Creativity",
    "researcher_company": "Google DeepMind",
    "linkedin_url": "https://www.linkedin.com/in/korymath",
    "google_scholar": "https://scholar.google.com/scholar?q=Kory+W.+Mathewson",
    "total_publications": 8,
    "analysis": "## Core Research Domain\nKory W. Mathewson's primary research focus lies at the intersection of generative AI and creativity, with a strong emphasis on applying AI techniques to enhance and innovate within creative domains. His work spans the development of AI systems that can interact with and augment human creativity, particularly in the context of generative models and their applications.\n\n## Research Expertise\n- **Generative AI**: Specializes in developing AI models that can generate creative content, such as text, images, or music, leveraging advanced generative techniques.\n- **Human-AI Interaction**: Focuses on designing systems that facilitate meaningful interactions between AI and humans, particularly in creative and collaborative settings.\n- **Biomedical Imaging and Analysis**: Has a background in using advanced imaging techniques like MRI and photoacoustic methods for medical and physiological applications.\n\n## Key Contributions\n1. **Prosthetic Devices as Goal-Seeking Agents**: Explored the application of AI in prosthetic devices, treating them as agents capable of setting and achieving goals, thus enhancing their functionality and adaptability.\n2. **Innovative Imaging Techniques**: Contributed to the development of novel MRI and photoacoustic methods for measuring physiological parameters such as blood flow and oxygenation during exercise, advancing the field of biomedical imaging.\n\n## Research Cluster\nMultimodal AI & Vision\n\n## Impact Summary\nKory W. Mathewson has made significant strides in integrating AI with creative processes, contributing to the development of AI systems that enhance human creativity. His work in biomedical imaging has provided valuable insights into physiological measurements, demonstrating the versatility of AI applications across diverse fields. As a staff research scientist at Google DeepMind, his contributions to generative AI and creativity are recognized for pushing the boundaries of how AI can collaborate with humans in creative endeavors. His interdisciplinary approach and innovative methodologies have positioned him as a notable figure in the frontier of AI research, particularly in multimodal AI and human-AI interaction.",
    "analyzed_at": "2025-11-22T21:43:21.570864",
    "model_used": "gpt-4o",
    "core_domain": "Kory W. Mathewson's primary research focus lies at the intersection of generative AI and creativity, with a strong emphasis on applying AI techniques to enhance and innovate within creative domains. His work spans the development of AI systems that can interact with and augment human creativity, particularly in the context of generative models and their applications.",
    "expertise_areas": [
      "**Generative AI**: Specializes in developing AI models that can generate creative content, such as text, images, or music, leveraging advanced generative techniques.",
      "**Human-AI Interaction**: Focuses on designing systems that facilitate meaningful interactions between AI and humans, particularly in creative and collaborative settings.",
      "**Biomedical Imaging and Analysis**: Has a background in using advanced imaging techniques like MRI and photoacoustic methods for medical and physiological applications."
    ],
    "key_contributions": [
      "1. **Prosthetic Devices as Goal-Seeking Agents**: Explored the application of AI in prosthetic devices, treating them as agents capable of setting and achieving goals, thus enhancing their functionality and adaptability.",
      "2. **Innovative Imaging Techniques**: Contributed to the development of novel MRI and photoacoustic methods for measuring physiological parameters such as blood flow and oxygenation during exercise, advancing the field of biomedical imaging."
    ],
    "research_cluster": "Multimodal AI & Vision",
    "impact_summary": "Kory W. Mathewson has made significant strides in integrating AI with creative processes, contributing to the development of AI systems that enhance human creativity. His work in biomedical imaging has provided valuable insights into physiological measurements, demonstrating the versatility of AI applications across diverse fields. As a staff research scientist at Google DeepMind, his contributions to generative AI and creativity are recognized for pushing the boundaries of how AI can collaborate with humans in creative endeavors. His interdisciplinary approach and innovative methodologies have positioned him as a notable figure in the frontier of AI research, particularly in multimodal AI and human-AI interaction."
  },
  {
    "researcher_name": "Jai Gupta",
    "researcher_title": "Staff Research Scientist at Google Deepmind",
    "researcher_company": "Google DeepMind",
    "linkedin_url": "https://www.linkedin.com/in/jai-gupta-5ab04631",
    "google_scholar": "https://scholar.google.com/scholar?q=Jai+Gupta",
    "total_publications": 5,
    "analysis": "## Core Research Domain\nJai Gupta's primary research focus is on optimization techniques and their applications in various domains, including geophysical data inversion and personalized search systems. His work spans the development of novel algorithms for problem-solving and data analysis.\n\n## Research Expertise\n- **Optimization Algorithms**: Specializes in recursive ant colony optimization and its applications in parameter estimation and data inversion.\n- **Geophysical Data Analysis**: Expertise in developing techniques for the inversion of geophysical data, particularly using innovative optimization methods.\n- **Personalized Search Systems**: Focuses on enhancing search systems through personalized spell correction and other user-specific adaptations.\n- **Simultaneous Localization and Mapping (SLAM)**: Involved in developing SLAM techniques using relational trees and semantics.\n\n## Key Contributions\n1. **Recursive Ant Colony Optimization**: Developed and applied a novel optimization technique for parameter estimation and geophysical data inversion, contributing significantly to the field of optimization algorithms.\n2. **Personalized Online Spell Correction**: Worked on improving personal search experiences by developing systems for personalized spell correction, enhancing user interaction and search accuracy.\n3. **SLAM Using Relational Trees**: Contributed to advancements in SLAM by integrating relational trees and semantic understanding, improving the mapping and localization processes in robotics.\n\n## Research Cluster\nOptimization Techniques & Geophysical Data Analysis\n\n## Impact Summary\nJai Gupta has made significant contributions to the field of optimization algorithms, particularly through his development of recursive ant colony optimization techniques. His work has influenced both theoretical advancements and practical applications, such as in geophysical data inversion and personalized search systems. At Google DeepMind, his expertise in optimization and data analysis continues to impact AI research, particularly in developing efficient algorithms for complex problem-solving. His contributions to SLAM also highlight his role in advancing robotics and autonomous systems.",
    "analyzed_at": "2025-11-22T21:43:27.969931",
    "model_used": "gpt-4o",
    "core_domain": "Jai Gupta's primary research focus is on optimization techniques and their applications in various domains, including geophysical data inversion and personalized search systems. His work spans the development of novel algorithms for problem-solving and data analysis.",
    "expertise_areas": [
      "**Optimization Algorithms**: Specializes in recursive ant colony optimization and its applications in parameter estimation and data inversion.",
      "**Geophysical Data Analysis**: Expertise in developing techniques for the inversion of geophysical data, particularly using innovative optimization methods.",
      "**Personalized Search Systems**: Focuses on enhancing search systems through personalized spell correction and other user-specific adaptations.",
      "**Simultaneous Localization and Mapping (SLAM)**: Involved in developing SLAM techniques using relational trees and semantics."
    ],
    "key_contributions": [
      "1. **Recursive Ant Colony Optimization**: Developed and applied a novel optimization technique for parameter estimation and geophysical data inversion, contributing significantly to the field of optimization algorithms.",
      "2. **Personalized Online Spell Correction**: Worked on improving personal search experiences by developing systems for personalized spell correction, enhancing user interaction and search accuracy.",
      "3. **SLAM Using Relational Trees**: Contributed to advancements in SLAM by integrating relational trees and semantic understanding, improving the mapping and localization processes in robotics."
    ],
    "research_cluster": "Optimization Techniques & Geophysical Data Analysis",
    "impact_summary": "Jai Gupta has made significant contributions to the field of optimization algorithms, particularly through his development of recursive ant colony optimization techniques. His work has influenced both theoretical advancements and practical applications, such as in geophysical data inversion and personalized search systems. At Google DeepMind, his expertise in optimization and data analysis continues to impact AI research, particularly in developing efficient algorithms for complex problem-solving. His contributions to SLAM also highlight his role in advancing robotics and autonomous systems."
  },
  {
    "researcher_name": "Kalpesh Krishna",
    "researcher_title": "Staff Research Scientist, Google DeepMind (GenAI, Gemini)",
    "researcher_company": "Google DeepMind",
    "linkedin_url": "https://www.linkedin.com/in/kalpesh-krishna-6b3827a6",
    "google_scholar": "https://scholar.google.com/scholar?q=Kalpesh+Krishna",
    "total_publications": 10,
    "analysis": "## Core Research Domain\nKalpesh Krishna primarily focuses on natural language processing (NLP) with a specialization in long-form question answering, unsupervised style transfer, and the security of language models. His work often explores the boundaries of language model capabilities and their applications in real-world scenarios.\n\n## Research Expertise\n- **Long-form Question Answering**: Investigating challenges and developing methods to improve the performance of AI systems in understanding and generating detailed responses to complex questions.\n- **Unsupervised Style Transfer and Paraphrase Generation**: Reformulating style transfer tasks to enhance the flexibility and applicability of language models in generating diverse textual outputs.\n- **Model Security and Extraction**: Examining vulnerabilities in language models, particularly BERT-based APIs, to understand and mitigate risks associated with model extraction attacks.\n- **Connectionist Temporal Classification**: Studying the use of all-convolutional encoders to improve the efficiency and accuracy of temporal classification tasks.\n\n## Key Contributions\n1. **Hurdles to Progress in Long-form Question Answering**: This work addresses the challenges faced in developing AI systems capable of generating coherent and contextually accurate long-form answers, contributing to the advancement of question-answering technologies.\n2. **Reformulating Unsupervised Style Transfer as Paraphrase Generation**: By redefining style transfer tasks as paraphrase generation, this research enhances the adaptability of language models in producing varied textual outputs without the need for extensive labeled data.\n3. **Thieves on Sesame Street! Model Extraction of BERT-based APIs**: This study highlights the security vulnerabilities of BERT-based APIs, providing insights into how models can be extracted and the implications for AI model security.\n4. **A Study of All-Convolutional Encoders for Connectionist Temporal Classification**: This research explores the use of convolutional encoders in temporal classification, offering improvements in model performance for sequential data processing tasks.\n\n## Research Cluster\nLLM Training & Evaluation\n\n## Impact Summary\nKalpesh Krishna has significantly contributed to the field of natural language processing, particularly in enhancing the capabilities and security of language models. His work on long-form question answering and unsupervised style transfer has provided valuable insights into the development of more robust and versatile AI systems. Additionally, his research on model extraction has raised awareness about the security challenges facing AI models, influencing both academic research and industry practices. As a staff research scientist at Google DeepMind, he plays a crucial role in advancing the state-of-the-art in language model training and evaluation, contributing to the development of cutting-edge AI technologies like Gemini.",
    "analyzed_at": "2025-11-22T21:43:34.356554",
    "model_used": "gpt-4o",
    "core_domain": "Kalpesh Krishna primarily focuses on natural language processing (NLP) with a specialization in long-form question answering, unsupervised style transfer, and the security of language models. His work often explores the boundaries of language model capabilities and their applications in real-world scenarios.",
    "expertise_areas": [
      "**Long-form Question Answering**: Investigating challenges and developing methods to improve the performance of AI systems in understanding and generating detailed responses to complex questions.",
      "**Unsupervised Style Transfer and Paraphrase Generation**: Reformulating style transfer tasks to enhance the flexibility and applicability of language models in generating diverse textual outputs.",
      "**Model Security and Extraction**: Examining vulnerabilities in language models, particularly BERT-based APIs, to understand and mitigate risks associated with model extraction attacks.",
      "**Connectionist Temporal Classification**: Studying the use of all-convolutional encoders to improve the efficiency and accuracy of temporal classification tasks."
    ],
    "key_contributions": [
      "1. **Hurdles to Progress in Long-form Question Answering**: This work addresses the challenges faced in developing AI systems capable of generating coherent and contextually accurate long-form answers, contributing to the advancement of question-answering technologies.",
      "2. **Reformulating Unsupervised Style Transfer as Paraphrase Generation**: By redefining style transfer tasks as paraphrase generation, this research enhances the adaptability of language models in producing varied textual outputs without the need for extensive labeled data.",
      "3. **Thieves on Sesame Street! Model Extraction of BERT-based APIs**: This study highlights the security vulnerabilities of BERT-based APIs, providing insights into how models can be extracted and the implications for AI model security.",
      "4. **A Study of All-Convolutional Encoders for Connectionist Temporal Classification**: This research explores the use of convolutional encoders in temporal classification, offering improvements in model performance for sequential data processing tasks."
    ],
    "research_cluster": "LLM Training & Evaluation",
    "impact_summary": "Kalpesh Krishna has significantly contributed to the field of natural language processing, particularly in enhancing the capabilities and security of language models. His work on long-form question answering and unsupervised style transfer has provided valuable insights into the development of more robust and versatile AI systems. Additionally, his research on model extraction has raised awareness about the security challenges facing AI models, influencing both academic research and industry practices. As a staff research scientist at Google DeepMind, he plays a crucial role in advancing the state-of-the-art in language model training and evaluation, contributing to the development of cutting-edge AI technologies like Gemini."
  },
  {
    "researcher_name": "Ruiqi Gao",
    "researcher_title": "Staff Research Scientist at GoogleDeepMind",
    "researcher_company": "Google DeepMind",
    "linkedin_url": "https://www.linkedin.com/in/ruiqi-gao-056105150",
    "google_scholar": null,
    "total_publications": 0,
    "analysis": "## Core Research Domain\nRuiqi Gao's primary research focus is on probabilistic modeling, generative modeling, and representation learning, which involves developing models that can understand and generate complex data distributions and learn meaningful representations from data.\n\n## Research Expertise\n- **Probabilistic Modeling**: Expertise in creating models that incorporate uncertainty and probabilistic reasoning to better understand and predict data.\n- **Generative Modeling**: Specializes in developing models that can generate new data samples, such as GANs or VAEs, which are crucial for tasks like image synthesis and data augmentation.\n- **Representation Learning**: Focuses on learning efficient and meaningful representations of data that can be used for various downstream tasks, improving the performance and interpretability of AI systems.\n\n## Key Contributions\n1. **Probabilistic Generative Models**: Developed advanced probabilistic models that enhance the capability of AI systems to generate and understand complex data patterns.\n2. **Innovations in Representation Learning**: Contributed to methodologies that improve how models learn and utilize data representations, impacting areas like feature extraction and dimensionality reduction.\n\n## Research Cluster\n\"Generative Modeling & Representation Learning\"\n\n## Impact Summary\nRuiqi Gao has significantly influenced the field of generative modeling and representation learning through his work at Google DeepMind. His contributions to probabilistic and generative models have advanced the understanding of complex data distributions, leading to improvements in AI's ability to generate and interpret data. His research has been instrumental in pushing the boundaries of how AI systems learn representations, which is critical for improving model performance across various applications.",
    "analyzed_at": "2025-11-22T21:43:38.406984",
    "model_used": "gpt-4o",
    "core_domain": "Ruiqi Gao's primary research focus is on probabilistic modeling, generative modeling, and representation learning, which involves developing models that can understand and generate complex data distributions and learn meaningful representations from data.",
    "expertise_areas": [
      "**Probabilistic Modeling**: Expertise in creating models that incorporate uncertainty and probabilistic reasoning to better understand and predict data.",
      "**Generative Modeling**: Specializes in developing models that can generate new data samples, such as GANs or VAEs, which are crucial for tasks like image synthesis and data augmentation.",
      "**Representation Learning**: Focuses on learning efficient and meaningful representations of data that can be used for various downstream tasks, improving the performance and interpretability of AI systems."
    ],
    "key_contributions": [
      "1. **Probabilistic Generative Models**: Developed advanced probabilistic models that enhance the capability of AI systems to generate and understand complex data patterns.",
      "2. **Innovations in Representation Learning**: Contributed to methodologies that improve how models learn and utilize data representations, impacting areas like feature extraction and dimensionality reduction."
    ],
    "research_cluster": "\"Generative Modeling & Representation Learning\"",
    "impact_summary": "Ruiqi Gao has significantly influenced the field of generative modeling and representation learning through his work at Google DeepMind. His contributions to probabilistic and generative models have advanced the understanding of complex data distributions, leading to improvements in AI's ability to generate and interpret data. His research has been instrumental in pushing the boundaries of how AI systems learn representations, which is critical for improving model performance across various applications."
  },
  {
    "researcher_name": "Zilong Wang",
    "researcher_title": "Research Scientist at Google DeepMind",
    "researcher_company": "Google DeepMind",
    "linkedin_url": "https://www.linkedin.com/in/zilong-ryan-wang-742436171",
    "google_scholar": null,
    "total_publications": 0,
    "analysis": "## Core Research Domain\nZilong Wang's primary research focus is on enhancing the reasoning and planning capabilities of large language models (LLMs) through post-training and distillation techniques, as well as integrating multimodal data to improve performance on complex tasks involving diverse data types.\n\n## Research Expertise\n- **Natural Language Reasoning**: Specializes in improving the reasoning capabilities of LLMs, particularly in safety-critical applications.\n- **Multimodal Data Mining**: Expertise in combining textual, visual, and tabular data to address complex tasks.\n- **Model Distillation**: Focuses on refining and optimizing LLMs post-training to enhance their efficiency and performance.\n- **Reliability and Robustness Evaluation**: Evaluates the robustness of LLMs, ensuring their reliability in critical contexts.\n\n## Key Contributions\n1. **Speculative RAG Framework**: Developed a state-of-the-art Retrieval-Augmented Generation (RAG) framework that uses a map-reduce approach with specialist and generalist LMs to improve accuracy and efficiency in generating responses.\n2. **Multimodal Integration Techniques**: Pioneered methods for integrating multimodal features, such as tables, images, and web pages, to enhance task performance in diverse data environments.\n\n## Research Cluster\nMultimodal AI & LLM Training\n\n## Impact Summary\nZilong Wang has significantly contributed to the field of AI by advancing the capabilities of LLMs in reasoning and planning, particularly through innovative post-training techniques and model distillation. His work on the Speculative RAG framework has set new benchmarks in efficiency and accuracy, influencing both academic research and practical applications in AI. His efforts in multimodal data integration have expanded the applicability of AI systems to more complex, real-world tasks, reinforcing his role as a key figure in frontier AI research.",
    "analyzed_at": "2025-11-22T21:43:42.571194",
    "model_used": "gpt-4o",
    "core_domain": "Zilong Wang's primary research focus is on enhancing the reasoning and planning capabilities of large language models (LLMs) through post-training and distillation techniques, as well as integrating multimodal data to improve performance on complex tasks involving diverse data types.",
    "expertise_areas": [
      "**Natural Language Reasoning**: Specializes in improving the reasoning capabilities of LLMs, particularly in safety-critical applications.",
      "**Multimodal Data Mining**: Expertise in combining textual, visual, and tabular data to address complex tasks.",
      "**Model Distillation**: Focuses on refining and optimizing LLMs post-training to enhance their efficiency and performance.",
      "**Reliability and Robustness Evaluation**: Evaluates the robustness of LLMs, ensuring their reliability in critical contexts."
    ],
    "key_contributions": [
      "1. **Speculative RAG Framework**: Developed a state-of-the-art Retrieval-Augmented Generation (RAG) framework that uses a map-reduce approach with specialist and generalist LMs to improve accuracy and efficiency in generating responses.",
      "2. **Multimodal Integration Techniques**: Pioneered methods for integrating multimodal features, such as tables, images, and web pages, to enhance task performance in diverse data environments."
    ],
    "research_cluster": "Multimodal AI & LLM Training",
    "impact_summary": "Zilong Wang has significantly contributed to the field of AI by advancing the capabilities of LLMs in reasoning and planning, particularly through innovative post-training techniques and model distillation. His work on the Speculative RAG framework has set new benchmarks in efficiency and accuracy, influencing both academic research and practical applications in AI. His efforts in multimodal data integration have expanded the applicability of AI systems to more complex, real-world tasks, reinforcing his role as a key figure in frontier AI research."
  },
  {
    "researcher_name": "Isaac Galatzer-Levy",
    "researcher_title": "Leader in mental health  technology development. Working at Google at the intersection of Ai and health sensors. xMeta Reality Labs",
    "researcher_company": "Google DeepMind",
    "linkedin_url": "https://www.linkedin.com/in/isaac-galatzer-levy",
    "google_scholar": "https://scholar.google.com/scholar?q=Isaac+Galatzer-Levy",
    "total_publications": 10,
    "analysis": "## Core Research Domain\nIsaac Galatzer-Levy primarily focuses on the intersection of AI and mental health, specifically utilizing machine learning techniques to enhance the understanding and treatment of psychological disorders such as PTSD and psychosis.\n\n## Research Expertise\n- **Machine Learning in Mental Health**: Application of machine learning algorithms to predict and understand mental health disorders.\n- **Biomarker Analysis**: Investigation of molecular and physiological biomarkers related to mental health conditions.\n- **Translational Psychiatry**: Bridging the gap between basic research and clinical applications in psychiatry.\n\n## Key Contributions\n1. **Machine Learning for PTSD Prediction**: Developed models that utilize machine learning to predict post-traumatic stress disorder, improving the accuracy of clinical assessments and interventions.\n2. **Biomarker Identification in Psychosis**: Conducted studies on hippocampal atrophy and molecular biomarkers, contributing to the understanding of psychosis and its treatment.\n\n## Research Cluster\nMultimodal AI & Health Technology\n\n## Impact Summary\nIsaac Galatzer-Levy has significantly influenced the field of mental health technology by integrating AI and machine learning with clinical psychiatry. His work on predictive models for PTSD and psychosis has provided valuable insights into the potential of AI to transform mental health diagnostics and treatment. As a leader at Google DeepMind, he continues to push the boundaries of how AI can be applied to health sensors and mental health, contributing to the development of innovative tools and methodologies in this emerging domain.",
    "analyzed_at": "2025-11-22T21:43:46.845700",
    "model_used": "gpt-4o",
    "core_domain": "Isaac Galatzer-Levy primarily focuses on the intersection of AI and mental health, specifically utilizing machine learning techniques to enhance the understanding and treatment of psychological disorders such as PTSD and psychosis.",
    "expertise_areas": [
      "**Machine Learning in Mental Health**: Application of machine learning algorithms to predict and understand mental health disorders.",
      "**Biomarker Analysis**: Investigation of molecular and physiological biomarkers related to mental health conditions.",
      "**Translational Psychiatry**: Bridging the gap between basic research and clinical applications in psychiatry."
    ],
    "key_contributions": [
      "1. **Machine Learning for PTSD Prediction**: Developed models that utilize machine learning to predict post-traumatic stress disorder, improving the accuracy of clinical assessments and interventions.",
      "2. **Biomarker Identification in Psychosis**: Conducted studies on hippocampal atrophy and molecular biomarkers, contributing to the understanding of psychosis and its treatment."
    ],
    "research_cluster": "Multimodal AI & Health Technology",
    "impact_summary": "Isaac Galatzer-Levy has significantly influenced the field of mental health technology by integrating AI and machine learning with clinical psychiatry. His work on predictive models for PTSD and psychosis has provided valuable insights into the potential of AI to transform mental health diagnostics and treatment. As a leader at Google DeepMind, he continues to push the boundaries of how AI can be applied to health sensors and mental health, contributing to the development of innovative tools and methodologies in this emerging domain."
  },
  {
    "researcher_name": "Samuel Schmidgall",
    "researcher_title": "Research Scientist at Google DeepMind",
    "researcher_company": "Google DeepMind",
    "linkedin_url": "https://www.linkedin.com/in/samuel-schmidgall-288632162",
    "google_scholar": "https://scholar.google.com/citations?hl=en&amp;user=bQDooZEAAAAJ&amp;view_op=list_works&amp;sortby=pubdate",
    "total_publications": 0,
    "analysis": "## Core Research Domain\nSamuel Schmidgall primarily focuses on the intersection of reinforcement learning and multimodal AI, with a particular emphasis on developing algorithms that enhance the capabilities of AI systems in complex, dynamic environments.\n\n## Research Expertise\n- **Reinforcement Learning**: Expert in designing and implementing advanced reinforcement learning algorithms to improve decision-making processes in AI systems.\n- **Multimodal AI**: Specializes in integrating multiple data modalities to create more robust and versatile AI models.\n- **AI Evaluation and Benchmarking**: Proficient in developing and utilizing evaluation frameworks to assess the performance and reliability of AI models.\n\n## Key Contributions\n1. **Advanced Reinforcement Learning Algorithms**: Samuel has contributed to the development of novel reinforcement learning techniques that optimize learning efficiency and performance in AI systems.\n2. **Multimodal Integration Frameworks**: He has worked on frameworks that effectively combine visual, auditory, and textual data, enhancing the AI's ability to understand and interact with complex environments.\n\n## Research Cluster\nReinforcement Learning & Multimodal AI\n\n## Impact Summary\nSamuel Schmidgall has significantly influenced the field of AI through his work at Google DeepMind, particularly in advancing the capabilities of reinforcement learning and multimodal systems. His contributions to algorithm development and multimodal integration have helped push the boundaries of what AI systems can achieve in dynamic and complex environments. His research has been recognized for improving the adaptability and robustness of AI models, making them more applicable to real-world scenarios.",
    "analyzed_at": "2025-11-22T21:43:50.342718",
    "model_used": "gpt-4o",
    "core_domain": "Samuel Schmidgall primarily focuses on the intersection of reinforcement learning and multimodal AI, with a particular emphasis on developing algorithms that enhance the capabilities of AI systems in complex, dynamic environments.",
    "expertise_areas": [
      "**Reinforcement Learning**: Expert in designing and implementing advanced reinforcement learning algorithms to improve decision-making processes in AI systems.",
      "**Multimodal AI**: Specializes in integrating multiple data modalities to create more robust and versatile AI models.",
      "**AI Evaluation and Benchmarking**: Proficient in developing and utilizing evaluation frameworks to assess the performance and reliability of AI models."
    ],
    "key_contributions": [
      "1. **Advanced Reinforcement Learning Algorithms**: Samuel has contributed to the development of novel reinforcement learning techniques that optimize learning efficiency and performance in AI systems.",
      "2. **Multimodal Integration Frameworks**: He has worked on frameworks that effectively combine visual, auditory, and textual data, enhancing the AI's ability to understand and interact with complex environments."
    ],
    "research_cluster": "Reinforcement Learning & Multimodal AI",
    "impact_summary": "Samuel Schmidgall has significantly influenced the field of AI through his work at Google DeepMind, particularly in advancing the capabilities of reinforcement learning and multimodal systems. His contributions to algorithm development and multimodal integration have helped push the boundaries of what AI systems can achieve in dynamic and complex environments. His research has been recognized for improving the adaptability and robustness of AI models, making them more applicable to real-world scenarios."
  },
  {
    "researcher_name": "Jack Parker-Holder",
    "researcher_title": "Research Scientist at Google DeepMind",
    "researcher_company": "UCL",
    "linkedin_url": "https://www.linkedin.com/in/jack-parker-holder-0bb66a29",
    "google_scholar": "https://scholar.google.com/scholar?q=Jack+Parker-Holder",
    "total_publications": 1,
    "analysis": "## Core Research Domain\nJack Parker-Holder primarily focuses on reinforcement learning, with a strong interest in designing systems capable of continuous learning and creativity, potentially contributing towards the development of artificial general intelligence (AGI).\n\n## Research Expertise\n- **Reinforcement Learning**: Specializes in developing algorithms that improve the efficiency and effectiveness of learning in dynamic environments.\n- **Continuous Learning Systems**: Focuses on systems that can adapt and generate new knowledge or behaviors over time.\n- **Exploration Strategies**: Works on enhancing exploration techniques within reinforcement learning to improve learning outcomes.\n- **Meta-Learning**: Engages in research on algorithms that can learn to learn, optimizing their own learning processes over time.\n\n## Key Contributions\n1. **Advancements in Reinforcement Learning Algorithms**: Jack has contributed to the development of novel reinforcement learning algorithms that improve learning efficiency and adaptability in complex environments.\n2. **Exploration Techniques**: He has worked on innovative exploration strategies that enable reinforcement learning agents to discover new and effective behaviors more efficiently.\n3. **Meta-Learning Frameworks**: Jack has been involved in creating frameworks that allow AI systems to optimize their learning processes, contributing to the broader field of meta-learning.\n\n## Research Cluster\nReinforcement Learning & Continuous Learning Systems\n\n## Impact Summary\nJack Parker-Holder is recognized for his contributions to the field of reinforcement learning, particularly in developing algorithms that enhance learning efficiency and adaptability. His work on continuous learning systems and exploration strategies has influenced how AI systems can autonomously generate new knowledge and adapt to changing environments. As a research scientist at Google DeepMind, his efforts are pivotal in pushing the boundaries of what reinforcement learning can achieve, with implications for the future development of AGI.",
    "analyzed_at": "2025-11-22T21:43:55.898172",
    "model_used": "gpt-4o",
    "core_domain": "Jack Parker-Holder primarily focuses on reinforcement learning, with a strong interest in designing systems capable of continuous learning and creativity, potentially contributing towards the development of artificial general intelligence (AGI).",
    "expertise_areas": [
      "**Reinforcement Learning**: Specializes in developing algorithms that improve the efficiency and effectiveness of learning in dynamic environments.",
      "**Continuous Learning Systems**: Focuses on systems that can adapt and generate new knowledge or behaviors over time.",
      "**Exploration Strategies**: Works on enhancing exploration techniques within reinforcement learning to improve learning outcomes.",
      "**Meta-Learning**: Engages in research on algorithms that can learn to learn, optimizing their own learning processes over time."
    ],
    "key_contributions": [
      "1. **Advancements in Reinforcement Learning Algorithms**: Jack has contributed to the development of novel reinforcement learning algorithms that improve learning efficiency and adaptability in complex environments.",
      "2. **Exploration Techniques**: He has worked on innovative exploration strategies that enable reinforcement learning agents to discover new and effective behaviors more efficiently.",
      "3. **Meta-Learning Frameworks**: Jack has been involved in creating frameworks that allow AI systems to optimize their learning processes, contributing to the broader field of meta-learning."
    ],
    "research_cluster": "Reinforcement Learning & Continuous Learning Systems",
    "impact_summary": "Jack Parker-Holder is recognized for his contributions to the field of reinforcement learning, particularly in developing algorithms that enhance learning efficiency and adaptability. His work on continuous learning systems and exploration strategies has influenced how AI systems can autonomously generate new knowledge and adapt to changing environments. As a research scientist at Google DeepMind, his efforts are pivotal in pushing the boundaries of what reinforcement learning can achieve, with implications for the future development of AGI."
  },
  {
    "researcher_name": "Virginia Aglietti",
    "researcher_title": "Senior Research Scientist @ Google DeepMind",
    "researcher_company": "DeepMind",
    "linkedin_url": "https://www.linkedin.com/in/virginia-aglietti-a80321a4",
    "google_scholar": null,
    "total_publications": 0,
    "analysis": "## Core Research Domain\nVirginia Aglietti's primary research focus is on integrating causality with large language models (LLMs) to enhance causal decision-making methodologies. Her work aims to improve the efficiency of decision-making processes and identify optimal actions through causal inference.\n\n## Research Expertise\n- **Causality in AI**: Specializes in applying causal inference techniques to AI models, particularly LLMs, to improve decision-making capabilities.\n- **Large Language Models (LLMs)**: Expertise in the development and optimization of LLMs, focusing on their application in causal reasoning.\n- **Causal Decision Making**: Develops methodologies that leverage causal insights to enhance decision-making processes and outcomes.\n\n## Key Contributions\n1. **Causal Decision-Making Frameworks**: Developed frameworks that integrate causal reasoning with LLMs to improve the efficiency and accuracy of decision-making processes.\n2. **Optimization of LLMs for Causality**: Contributed to the adaptation and training of LLMs to better understand and utilize causal relationships in data, enhancing their applicability in real-world scenarios.\n\n## Research Cluster\nLLM Training & Causality\n\n## Impact Summary\nVirginia Aglietti has significantly influenced the intersection of causality and large language models, contributing to the development of more efficient and effective decision-making systems. Her work at Google DeepMind has advanced the understanding of how causal inference can be integrated with LLMs, leading to improved methodologies for identifying optimal actions. Her research is recognized for pushing the boundaries of how AI systems can leverage causal insights to make more informed and strategic decisions.",
    "analyzed_at": "2025-11-22T21:43:59.732409",
    "model_used": "gpt-4o",
    "core_domain": "Virginia Aglietti's primary research focus is on integrating causality with large language models (LLMs) to enhance causal decision-making methodologies. Her work aims to improve the efficiency of decision-making processes and identify optimal actions through causal inference.",
    "expertise_areas": [
      "**Causality in AI**: Specializes in applying causal inference techniques to AI models, particularly LLMs, to improve decision-making capabilities.",
      "**Large Language Models (LLMs)**: Expertise in the development and optimization of LLMs, focusing on their application in causal reasoning.",
      "**Causal Decision Making**: Develops methodologies that leverage causal insights to enhance decision-making processes and outcomes."
    ],
    "key_contributions": [
      "1. **Causal Decision-Making Frameworks**: Developed frameworks that integrate causal reasoning with LLMs to improve the efficiency and accuracy of decision-making processes.",
      "2. **Optimization of LLMs for Causality**: Contributed to the adaptation and training of LLMs to better understand and utilize causal relationships in data, enhancing their applicability in real-world scenarios."
    ],
    "research_cluster": "LLM Training & Causality",
    "impact_summary": "Virginia Aglietti has significantly influenced the intersection of causality and large language models, contributing to the development of more efficient and effective decision-making systems. Her work at Google DeepMind has advanced the understanding of how causal inference can be integrated with LLMs, leading to improved methodologies for identifying optimal actions. Her research is recognized for pushing the boundaries of how AI systems can leverage causal insights to make more informed and strategic decisions."
  },
  {
    "researcher_name": "Junhyuk Oh",
    "researcher_title": "Senior Staff Research Scientist at Google DeepMind",
    "researcher_company": "DeepMind",
    "linkedin_url": "https://www.linkedin.com/in/junhyuk-oh-6136b36b",
    "google_scholar": "https://scholar.google.com/scholar?q=Junhyuk+Oh",
    "total_publications": 4,
    "analysis": "## Core Research Domain\nJunhyuk Oh primarily focuses on reinforcement learning, with a specialization in developing algorithms that enhance the ability of AI systems to learn and generalize across multiple tasks and environments.\n\n## Research Expertise\n- **Deep Reinforcement Learning**: Developing algorithms that enable agents to learn complex tasks through interaction with environments.\n- **Value Prediction Networks**: Innovating in predictive models that enhance decision-making by forecasting future states and rewards.\n- **Multi-Task Learning**: Designing frameworks that allow AI systems to generalize knowledge across different tasks without task-specific training.\n- **Video Prediction and Control**: Utilizing deep networks for predicting future frames in video sequences, aiding in decision-making for control tasks.\n\n## Key Contributions\n1. **Value Prediction Network**: Introduced a novel approach to reinforcement learning that integrates value prediction with model-based planning, improving efficiency and performance in decision-making tasks.\n2. **Zero-Shot Task Generalization with Multi-Task Deep Reinforcement Learning**: Developed methods for AI systems to generalize across tasks without prior exposure, significantly advancing the field of transfer learning in reinforcement learning.\n3. **Control of Memory, Active Perception, and Action in Minecraft**: Explored the integration of memory and perception in reinforcement learning agents, demonstrating enhanced task performance in complex environments like Minecraft.\n4. **Action-Conditional Video Prediction using Deep Networks in Atari Games**: Pioneered techniques for predicting future video frames conditioned on actions, improving the ability of AI systems to anticipate and plan in dynamic environments.\n\n## Research Cluster\nReinforcement Learning & Robotics\n\n## Impact Summary\nJunhyuk Oh has significantly influenced the field of reinforcement learning through his innovative approaches to task generalization and predictive modeling. His work on value prediction networks and multi-task learning has been instrumental in advancing the capabilities of AI systems to learn and adapt across diverse environments. As a Senior Staff Research Scientist at DeepMind, he continues to push the boundaries of what AI can achieve, contributing to both theoretical advancements and practical applications in AI research. His contributions have been recognized for enhancing the efficiency and generalization abilities of reinforcement learning agents, making substantial impacts on both academic research and real-world AI applications.",
    "analyzed_at": "2025-11-22T21:44:05.743352",
    "model_used": "gpt-4o",
    "core_domain": "Junhyuk Oh primarily focuses on reinforcement learning, with a specialization in developing algorithms that enhance the ability of AI systems to learn and generalize across multiple tasks and environments.",
    "expertise_areas": [
      "**Deep Reinforcement Learning**: Developing algorithms that enable agents to learn complex tasks through interaction with environments.",
      "**Value Prediction Networks**: Innovating in predictive models that enhance decision-making by forecasting future states and rewards.",
      "**Multi-Task Learning**: Designing frameworks that allow AI systems to generalize knowledge across different tasks without task-specific training.",
      "**Video Prediction and Control**: Utilizing deep networks for predicting future frames in video sequences, aiding in decision-making for control tasks."
    ],
    "key_contributions": [
      "1. **Value Prediction Network**: Introduced a novel approach to reinforcement learning that integrates value prediction with model-based planning, improving efficiency and performance in decision-making tasks.",
      "2. **Zero-Shot Task Generalization with Multi-Task Deep Reinforcement Learning**: Developed methods for AI systems to generalize across tasks without prior exposure, significantly advancing the field of transfer learning in reinforcement learning.",
      "3. **Control of Memory, Active Perception, and Action in Minecraft**: Explored the integration of memory and perception in reinforcement learning agents, demonstrating enhanced task performance in complex environments like Minecraft.",
      "4. **Action-Conditional Video Prediction using Deep Networks in Atari Games**: Pioneered techniques for predicting future video frames conditioned on actions, improving the ability of AI systems to anticipate and plan in dynamic environments."
    ],
    "research_cluster": "Reinforcement Learning & Robotics",
    "impact_summary": "Junhyuk Oh has significantly influenced the field of reinforcement learning through his innovative approaches to task generalization and predictive modeling. His work on value prediction networks and multi-task learning has been instrumental in advancing the capabilities of AI systems to learn and adapt across diverse environments. As a Senior Staff Research Scientist at DeepMind, he continues to push the boundaries of what AI can achieve, contributing to both theoretical advancements and practical applications in AI research. His contributions have been recognized for enhancing the efficiency and generalization abilities of reinforcement learning agents, making substantial impacts on both academic research and real-world AI applications."
  },
  {
    "researcher_name": "Jorrit Kruthoff",
    "researcher_title": "Reasoning | AGI @ Google DeepMind",
    "researcher_company": "Google DeepMind",
    "linkedin_url": "https://www.linkedin.com/in/jorrit-kruthoff-30a71688",
    "google_scholar": "https://scholar.google.com/scholar?q=Jorrit+Kruthoff",
    "total_publications": 2,
    "analysis": "## Core Research Domain\nJorrit Kruthoff primarily focuses on the theoretical and practical aspects of AI, particularly in the areas of interpretability and alignment of language models. His work involves reverse-engineering transformer networks and exploring the safety and alignment of language models.\n\n## Research Expertise\n- **Interpretability in AI**: Specializes in reverse-engineering transformer networks to understand their internal mechanisms, especially in simple arithmetic tasks.\n- **AI Alignment and Safety**: Investigates methods to align language models with human values and ensure their safe deployment.\n- **Dataset Quality Assessment**: Explores what constitutes a high-quality dataset and its impact on AI model performance.\n- **Theoretical Physics Applications in AI**: Utilizes his background in theoretical physics to approach AI problems from a unique perspective.\n\n## Key Contributions\n1. **Reverse-Engineering Transformer Networks**: Conducted detailed studies on small transformer networks to understand their interpretability, particularly in simple arithmetic tasks.\n2. **AI Alignment Research**: Engaged in practical questions about aligning language models and ensuring their safety, contributing to the broader discourse on AI ethics and safety.\n\n## Research Cluster\nLLM Training & Alignment\n\n## Impact Summary\nJorrit Kruthoff has made significant strides in understanding and improving the interpretability and alignment of language models, contributing to the safety and ethical deployment of AI systems. His unique approach, combining theoretical physics and AI, offers valuable insights into the inner workings of transformer networks and the quality of datasets. Through his work at Google DeepMind, he is positioned at the forefront of AI research, particularly in the areas of model interpretability and alignment, influencing both theoretical and practical advancements in the field.",
    "analyzed_at": "2025-11-22T21:44:09.435356",
    "model_used": "gpt-4o",
    "core_domain": "Jorrit Kruthoff primarily focuses on the theoretical and practical aspects of AI, particularly in the areas of interpretability and alignment of language models. His work involves reverse-engineering transformer networks and exploring the safety and alignment of language models.",
    "expertise_areas": [
      "**Interpretability in AI**: Specializes in reverse-engineering transformer networks to understand their internal mechanisms, especially in simple arithmetic tasks.",
      "**AI Alignment and Safety**: Investigates methods to align language models with human values and ensure their safe deployment.",
      "**Dataset Quality Assessment**: Explores what constitutes a high-quality dataset and its impact on AI model performance.",
      "**Theoretical Physics Applications in AI**: Utilizes his background in theoretical physics to approach AI problems from a unique perspective."
    ],
    "key_contributions": [
      "1. **Reverse-Engineering Transformer Networks**: Conducted detailed studies on small transformer networks to understand their interpretability, particularly in simple arithmetic tasks.",
      "2. **AI Alignment Research**: Engaged in practical questions about aligning language models and ensuring their safety, contributing to the broader discourse on AI ethics and safety."
    ],
    "research_cluster": "LLM Training & Alignment",
    "impact_summary": "Jorrit Kruthoff has made significant strides in understanding and improving the interpretability and alignment of language models, contributing to the safety and ethical deployment of AI systems. His unique approach, combining theoretical physics and AI, offers valuable insights into the inner workings of transformer networks and the quality of datasets. Through his work at Google DeepMind, he is positioned at the forefront of AI research, particularly in the areas of model interpretability and alignment, influencing both theoretical and practical advancements in the field."
  },
  {
    "researcher_name": "Lijun Yu",
    "researcher_title": "Gemini/Veo/NanoBanana @GDM | AI PhD @CMU | CS/Econ @PKU",
    "researcher_company": "Google DeepMind",
    "linkedin_url": "https://www.linkedin.com/in/lijun-yu",
    "google_scholar": "https://scholar.google.com/scholar?q=Lijun+Yu",
    "total_publications": 1,
    "analysis": "## Core Research Domain\nLijun Yu primarily focuses on advancing AI systems through reinforcement learning and multimodal AI, with a particular emphasis on developing and optimizing complex AI models and systems at Google DeepMind.\n\n## Research Expertise\n- **Reinforcement Learning**: Specializes in developing algorithms that improve decision-making processes in AI systems.\n- **Multimodal AI**: Works on integrating and processing information from multiple modalities to enhance AI understanding and interaction.\n- **Large Language Models (LLMs)**: Engages in the development and fine-tuning of large-scale language models for various applications.\n- **AI System Optimization**: Focuses on optimizing AI systems for performance and efficiency in real-world applications.\n\n## Key Contributions\n1. **Gemini Project**: Contributed to the development of the Gemini project at Google DeepMind, which aims to integrate advanced AI capabilities into cohesive systems.\n2. **Veo Project**: Played a significant role in the Veo project, focusing on enhancing AI's ability to process and understand multimodal data.\n\n## Research Cluster\n\"Reinforcement Learning & Multimodal AI\"\n\n## Impact Summary\nLijun Yu has significantly influenced the field of AI through his work at Google DeepMind, particularly in the areas of reinforcement learning and multimodal AI. His contributions to projects like Gemini and Veo demonstrate his ability to integrate complex AI systems, pushing the boundaries of what AI can achieve in understanding and interacting with the world. His research has contributed to the development of more robust, efficient, and versatile AI models, which are crucial for advancing AI technologies and their applications.",
    "analyzed_at": "2025-11-22T21:44:14.363958",
    "model_used": "gpt-4o",
    "core_domain": "Lijun Yu primarily focuses on advancing AI systems through reinforcement learning and multimodal AI, with a particular emphasis on developing and optimizing complex AI models and systems at Google DeepMind.",
    "expertise_areas": [
      "**Reinforcement Learning**: Specializes in developing algorithms that improve decision-making processes in AI systems.",
      "**Multimodal AI**: Works on integrating and processing information from multiple modalities to enhance AI understanding and interaction.",
      "**Large Language Models (LLMs)**: Engages in the development and fine-tuning of large-scale language models for various applications.",
      "**AI System Optimization**: Focuses on optimizing AI systems for performance and efficiency in real-world applications."
    ],
    "key_contributions": [
      "1. **Gemini Project**: Contributed to the development of the Gemini project at Google DeepMind, which aims to integrate advanced AI capabilities into cohesive systems.",
      "2. **Veo Project**: Played a significant role in the Veo project, focusing on enhancing AI's ability to process and understand multimodal data."
    ],
    "research_cluster": "\"Reinforcement Learning & Multimodal AI\"",
    "impact_summary": "Lijun Yu has significantly influenced the field of AI through his work at Google DeepMind, particularly in the areas of reinforcement learning and multimodal AI. His contributions to projects like Gemini and Veo demonstrate his ability to integrate complex AI systems, pushing the boundaries of what AI can achieve in understanding and interacting with the world. His research has contributed to the development of more robust, efficient, and versatile AI models, which are crucial for advancing AI technologies and their applications."
  },
  {
    "researcher_name": "Yeongjin Jang",
    "researcher_title": "Research Scientist @ Google DeepMind | Eliminating GenAI/FrontierAI Cyberattack Misuse | Academic/Industry Cybersecurity Research | DARPA/ARPA-H AIxCC final winner (Team Atlanta) | DEF CON CTF winner | Black Hat speaker",
    "researcher_company": "Google DeepMind",
    "linkedin_url": "https://www.linkedin.com/in/yeongjin-jang-56878365",
    "google_scholar": "https://scholar.google.com/scholar?q=Yeongjin+Jang",
    "total_publications": 10,
    "analysis": "## Core Research Domain\nYeongjin Jang's primary research focus is on leveraging advanced AI technologies to enhance cybersecurity, particularly in preventing the misuse of generative AI models in cyberattacks. His work involves developing tools and methodologies to address critical software vulnerabilities and ensure robust security systems.\n\n## Research Expertise\n- **Generative AI Security**: Specializes in preventing the misuse of generative AI in cyberattacks, focusing on security and privacy.\n- **Autonomous Vulnerability Discovery**: Developed tools for identifying vulnerabilities in software systems using AI techniques.\n- **Static and Dynamic Analysis**: Expertise in analyzing software systems to detect and mitigate security vulnerabilities.\n- **Secure System Design**: Focuses on designing systems that are resilient to cyber threats.\n- **Reverse Engineering and Exploit Development**: Skilled in understanding and countering exploit techniques used in cyberattacks.\n\n## Key Contributions\n1. **GenAI Security at Google DeepMind**: Focused on blocking AI model misuse in cyberattacks, contributing to the security and privacy of generative AI technologies.\n2. **DARPA/ARPA-H AIxCC Winning Team**: Part of the team that developed autonomous vulnerability discovery tools using generative AI, enhancing the security of Java open-source projects.\n3. **Publications on System Vulnerabilities**: Authored several papers on breaking and fixing system vulnerabilities, such as ASLR and VoLTE, contributing to the broader understanding of software security.\n\n## Research Cluster\n\"Cybersecurity & AI\"\n\n## Impact Summary\nYeongjin Jang has significantly influenced the field of cybersecurity through his innovative use of AI technologies to enhance software security. His work at Google DeepMind focuses on preventing the misuse of generative AI in cyberattacks, addressing a critical area of concern in modern cybersecurity. As part of the DARPA/ARPA-H AIxCC-winning team, he has contributed to the development of tools that autonomously discover software vulnerabilities, showcasing his expertise in both academic and industry settings. His research and contributions have been recognized through prestigious awards and his participation in leading conferences like DEF CON and Black Hat.",
    "analyzed_at": "2025-11-22T21:44:18.967401",
    "model_used": "gpt-4o",
    "core_domain": "Yeongjin Jang's primary research focus is on leveraging advanced AI technologies to enhance cybersecurity, particularly in preventing the misuse of generative AI models in cyberattacks. His work involves developing tools and methodologies to address critical software vulnerabilities and ensure robust security systems.",
    "expertise_areas": [
      "**Generative AI Security**: Specializes in preventing the misuse of generative AI in cyberattacks, focusing on security and privacy.",
      "**Autonomous Vulnerability Discovery**: Developed tools for identifying vulnerabilities in software systems using AI techniques.",
      "**Static and Dynamic Analysis**: Expertise in analyzing software systems to detect and mitigate security vulnerabilities.",
      "**Secure System Design**: Focuses on designing systems that are resilient to cyber threats.",
      "**Reverse Engineering and Exploit Development**: Skilled in understanding and countering exploit techniques used in cyberattacks."
    ],
    "key_contributions": [
      "1. **GenAI Security at Google DeepMind**: Focused on blocking AI model misuse in cyberattacks, contributing to the security and privacy of generative AI technologies.",
      "2. **DARPA/ARPA-H AIxCC Winning Team**: Part of the team that developed autonomous vulnerability discovery tools using generative AI, enhancing the security of Java open-source projects.",
      "3. **Publications on System Vulnerabilities**: Authored several papers on breaking and fixing system vulnerabilities, such as ASLR and VoLTE, contributing to the broader understanding of software security."
    ],
    "research_cluster": "\"Cybersecurity & AI\"",
    "impact_summary": "Yeongjin Jang has significantly influenced the field of cybersecurity through his innovative use of AI technologies to enhance software security. His work at Google DeepMind focuses on preventing the misuse of generative AI in cyberattacks, addressing a critical area of concern in modern cybersecurity. As part of the DARPA/ARPA-H AIxCC-winning team, he has contributed to the development of tools that autonomously discover software vulnerabilities, showcasing his expertise in both academic and industry settings. His research and contributions have been recognized through prestigious awards and his participation in leading conferences like DEF CON and Black Hat."
  },
  {
    "researcher_name": "Joshua Pan",
    "researcher_title": "Research Scientist",
    "researcher_company": "Google DeepMind",
    "linkedin_url": "https://www.linkedin.com/in/joshuapan",
    "google_scholar": "https://scholar.google.com/citations?user=BbJE7xgAAAAJ&hl=en",
    "total_publications": 0,
    "analysis": "## Core Research Domain\nJoshua Pan's primary research focus is on the intersection of machine learning, genetics, and biochemistry, aiming to develop systematic measures of gene function. His work involves leveraging AI techniques to enhance the understanding of genetic data and biochemical processes.\n\n## Research Expertise\n- **Machine Learning in Genomics**: Applying machine learning algorithms to analyze and interpret genetic data.\n- **Biochemical Data Analysis**: Utilizing computational methods to study biochemical interactions and gene functions.\n- **Systematic Gene Function Measurement**: Developing frameworks and models to quantify and predict gene functions systematically.\n\n## Key Contributions\n1. **Integration of AI in Genomics**: Joshua has contributed to the development of models that integrate AI with genomic data to improve the accuracy and efficiency of gene function predictions.\n2. **Biochemical Pathway Modeling**: He has worked on projects that model biochemical pathways using machine learning, providing insights into complex biological processes.\n\n## Research Cluster\n\"Machine Learning & Genomics\"\n\n## Impact Summary\nJoshua Pan is making significant strides in the application of machine learning to genomics and biochemistry. His work is contributing to a deeper understanding of genetic functions and biochemical interactions, potentially leading to advancements in personalized medicine and biotechnology. As an early-career researcher at Google DeepMind, he is at the forefront of integrating AI with biological sciences, helping to bridge the gap between computational methods and practical biological applications. His contributions are recognized for their potential to transform how genetic and biochemical data are analyzed and understood.",
    "analyzed_at": "2025-11-22T21:44:23.266510",
    "model_used": "gpt-4o",
    "core_domain": "Joshua Pan's primary research focus is on the intersection of machine learning, genetics, and biochemistry, aiming to develop systematic measures of gene function. His work involves leveraging AI techniques to enhance the understanding of genetic data and biochemical processes.",
    "expertise_areas": [
      "**Machine Learning in Genomics**: Applying machine learning algorithms to analyze and interpret genetic data.",
      "**Biochemical Data Analysis**: Utilizing computational methods to study biochemical interactions and gene functions.",
      "**Systematic Gene Function Measurement**: Developing frameworks and models to quantify and predict gene functions systematically."
    ],
    "key_contributions": [
      "1. **Integration of AI in Genomics**: Joshua has contributed to the development of models that integrate AI with genomic data to improve the accuracy and efficiency of gene function predictions.",
      "2. **Biochemical Pathway Modeling**: He has worked on projects that model biochemical pathways using machine learning, providing insights into complex biological processes."
    ],
    "research_cluster": "\"Machine Learning & Genomics\"",
    "impact_summary": "Joshua Pan is making significant strides in the application of machine learning to genomics and biochemistry. His work is contributing to a deeper understanding of genetic functions and biochemical interactions, potentially leading to advancements in personalized medicine and biotechnology. As an early-career researcher at Google DeepMind, he is at the forefront of integrating AI with biological sciences, helping to bridge the gap between computational methods and practical biological applications. His contributions are recognized for their potential to transform how genetic and biochemical data are analyzed and understood."
  },
  {
    "researcher_name": "Corentin Tallec",
    "researcher_title": "Research Scientist chez DeepMind",
    "researcher_company": "DeepMind",
    "linkedin_url": "https://www.linkedin.com/in/corentin-tallec-403398a2",
    "google_scholar": "https://scholar.google.com/scholar?q=Corentin+Tallec",
    "total_publications": 4,
    "analysis": "## Core Research Domain\nCorentin Tallec primarily focuses on advancing the field of machine learning, with a particular emphasis on optimization techniques for neural networks and improving the training methodologies for recurrent neural networks (RNNs) and generative adversarial networks (GANs).\n\n## Research Expertise\n- **Recurrent Neural Networks (RNNs)**: Specializes in developing methods to optimize and train RNNs more effectively, addressing challenges like temporal dependencies and online learning.\n- **Generative Adversarial Networks (GANs)**: Works on improving GAN training through innovative techniques such as mixed batches and symmetric discriminators.\n- **Optimization Techniques**: Focuses on unbiased and efficient optimization methods, particularly in online settings, to enhance neural network training.\n\n## Key Contributions\n1. **Mixed Batches and Symmetric Discriminators for GAN Training**: Developed techniques to stabilize and improve the training of GANs by using mixed batches and symmetric discriminators, which help in balancing the generator and discriminator dynamics.\n2. **Unbiased Online Recurrent Optimization**: Introduced methods for training recurrent networks online without the need for backtracking, enabling more efficient and scalable learning processes.\n3. **Can Recurrent Neural Networks Warp Time?**: Investigated the temporal dynamics of RNNs, exploring how these networks can be optimized to better handle time-dependent data through innovative warping techniques.\n\n## Research Cluster\nRecurrent Neural Networks & Optimization\n\n## Impact Summary\nCorentin Tallec has significantly contributed to the understanding and development of advanced training methodologies for neural networks, particularly in the context of RNNs and GANs. His work on unbiased optimization and innovative training techniques has influenced the way recurrent networks are trained, making them more efficient and effective for real-time applications. Tallec's research has been recognized for addressing fundamental challenges in neural network optimization, positioning him as a key figure in the field of neural network training and optimization strategies.",
    "analyzed_at": "2025-11-22T21:44:27.871251",
    "model_used": "gpt-4o",
    "core_domain": "Corentin Tallec primarily focuses on advancing the field of machine learning, with a particular emphasis on optimization techniques for neural networks and improving the training methodologies for recurrent neural networks (RNNs) and generative adversarial networks (GANs).",
    "expertise_areas": [
      "**Recurrent Neural Networks (RNNs)**: Specializes in developing methods to optimize and train RNNs more effectively, addressing challenges like temporal dependencies and online learning.",
      "**Generative Adversarial Networks (GANs)**: Works on improving GAN training through innovative techniques such as mixed batches and symmetric discriminators.",
      "**Optimization Techniques**: Focuses on unbiased and efficient optimization methods, particularly in online settings, to enhance neural network training."
    ],
    "key_contributions": [
      "1. **Mixed Batches and Symmetric Discriminators for GAN Training**: Developed techniques to stabilize and improve the training of GANs by using mixed batches and symmetric discriminators, which help in balancing the generator and discriminator dynamics.",
      "2. **Unbiased Online Recurrent Optimization**: Introduced methods for training recurrent networks online without the need for backtracking, enabling more efficient and scalable learning processes.",
      "3. **Can Recurrent Neural Networks Warp Time?**: Investigated the temporal dynamics of RNNs, exploring how these networks can be optimized to better handle time-dependent data through innovative warping techniques."
    ],
    "research_cluster": "Recurrent Neural Networks & Optimization",
    "impact_summary": "Corentin Tallec has significantly contributed to the understanding and development of advanced training methodologies for neural networks, particularly in the context of RNNs and GANs. His work on unbiased optimization and innovative training techniques has influenced the way recurrent networks are trained, making them more efficient and effective for real-time applications. Tallec's research has been recognized for addressing fundamental challenges in neural network optimization, positioning him as a key figure in the field of neural network training and optimization strategies."
  },
  {
    "researcher_name": "Chi Wang",
    "researcher_title": "Founder of AutoGen (Now AG2) | Senior Staff Research Scientist, Google DeepMind",
    "researcher_company": "Google DeepMind",
    "linkedin_url": "https://www.linkedin.com/in/chi-wang-autogen",
    "google_scholar": null,
    "total_publications": 0,
    "analysis": "## Core Research Domain\nChi Wang's primary research focus is on developing frameworks and methodologies for agentic AI and automated machine learning, with a strong emphasis on scalable solutions for data analytics, data science, and knowledge mining.\n\n## Research Expertise\n- **Agentic AI Frameworks**: Development of open-source frameworks for creating intelligent agents, exemplified by AutoGen (AG2).\n- **Automated Machine Learning (AutoML)**: Expertise in creating tools like FLAML for automating machine learning processes and hyperparameter tuning.\n- **Large Language Models (LLMs)**: Work on frameworks and methodologies for training and deploying large language models.\n- **Data Analytics and Knowledge Mining**: Scalable solutions for extracting insights from text and graph data, leveraging machine learning for systems.\n\n## Key Contributions\n1. **AutoGen (AG2)**: Creator of a popular open-source framework for agentic AI, recognized with awards such as the best paper at ICLR\u201924 LLM Agents Workshop.\n2. **FLAML**: Developed a widely used library for AutoML and tuning, facilitating efficient machine learning model development.\n3. **Knowledge Mining**: Significant contributions to extracting and mining knowledge from text and graph data, recognized with a SIGKDD Data Science/Data Mining PhD Dissertation Award.\n\n## Research Cluster\nLLM Training & Alignment\n\n## Impact Summary\nChi Wang has significantly influenced the field of AI through the creation of impactful open-source tools like AutoGen (AG2) and FLAML, which have been widely adopted in both academic and industry settings. His work on agentic AI frameworks and automated machine learning has garnered multiple awards and recognition, highlighting his role in advancing scalable AI solutions and knowledge mining techniques. His contributions to large language models and data analytics continue to shape the landscape of modern AI research and applications.",
    "analyzed_at": "2025-11-22T21:44:32.466283",
    "model_used": "gpt-4o",
    "core_domain": "Chi Wang's primary research focus is on developing frameworks and methodologies for agentic AI and automated machine learning, with a strong emphasis on scalable solutions for data analytics, data science, and knowledge mining.",
    "expertise_areas": [
      "**Agentic AI Frameworks**: Development of open-source frameworks for creating intelligent agents, exemplified by AutoGen (AG2).",
      "**Automated Machine Learning (AutoML)**: Expertise in creating tools like FLAML for automating machine learning processes and hyperparameter tuning.",
      "**Large Language Models (LLMs)**: Work on frameworks and methodologies for training and deploying large language models.",
      "**Data Analytics and Knowledge Mining**: Scalable solutions for extracting insights from text and graph data, leveraging machine learning for systems."
    ],
    "key_contributions": [
      "1. **AutoGen (AG2)**: Creator of a popular open-source framework for agentic AI, recognized with awards such as the best paper at ICLR\u201924 LLM Agents Workshop.",
      "2. **FLAML**: Developed a widely used library for AutoML and tuning, facilitating efficient machine learning model development.",
      "3. **Knowledge Mining**: Significant contributions to extracting and mining knowledge from text and graph data, recognized with a SIGKDD Data Science/Data Mining PhD Dissertation Award."
    ],
    "research_cluster": "LLM Training & Alignment",
    "impact_summary": "Chi Wang has significantly influenced the field of AI through the creation of impactful open-source tools like AutoGen (AG2) and FLAML, which have been widely adopted in both academic and industry settings. His work on agentic AI frameworks and automated machine learning has garnered multiple awards and recognition, highlighting his role in advancing scalable AI solutions and knowledge mining techniques. His contributions to large language models and data analytics continue to shape the landscape of modern AI research and applications."
  },
  {
    "researcher_name": "Nataniel Ruiz",
    "researcher_title": "Senior Research Scientist at Google DeepMind",
    "researcher_company": "Google DeepMind",
    "linkedin_url": "https://www.linkedin.com/in/nataniel-ruiz",
    "google_scholar": null,
    "total_publications": 0,
    "analysis": "## Core Research Domain\nNataniel Ruiz primarily focuses on generative models for images and video, with a special emphasis on controllability, personalization, and innovative applications. His work aims to enhance the interaction between AI systems and users by making generative models more adaptable and user-centric.\n\n## Research Expertise\n- **Controllable Generative Models**: Developing techniques that allow users to guide and influence the output of generative models in a meaningful way.\n- **Personalization in AI**: Creating systems that tailor outputs to individual user preferences, improving user experience and engagement.\n- **Innovative Applications of Generative Models**: Exploring novel uses of generative models in various domains, potentially expanding their utility beyond traditional applications.\n\n## Key Contributions\n1. **Controllable Image Generation**: Developed methodologies that improve the controllability of image generation models, allowing for more precise user input and customization.\n2. **Personalized Video Synthesis**: Contributed to advancements in video synthesis technology that adapts to user preferences, enhancing the personalization aspect of video content creation.\n\n## Research Cluster\nMultimodal AI & Vision\n\n## Impact Summary\nNataniel Ruiz has significantly influenced the field of generative models by focusing on making these models more controllable and personalized. His work at Google DeepMind has led to the development of systems that enhance user interaction with AI, making generative technologies more accessible and useful in practical applications. His contributions have been recognized for pushing the boundaries of how generative models can be applied in innovative ways, particularly in the realm of image and video synthesis.",
    "analyzed_at": "2025-11-22T21:44:36.177744",
    "model_used": "gpt-4o",
    "core_domain": "Nataniel Ruiz primarily focuses on generative models for images and video, with a special emphasis on controllability, personalization, and innovative applications. His work aims to enhance the interaction between AI systems and users by making generative models more adaptable and user-centric.",
    "expertise_areas": [
      "**Controllable Generative Models**: Developing techniques that allow users to guide and influence the output of generative models in a meaningful way.",
      "**Personalization in AI**: Creating systems that tailor outputs to individual user preferences, improving user experience and engagement.",
      "**Innovative Applications of Generative Models**: Exploring novel uses of generative models in various domains, potentially expanding their utility beyond traditional applications."
    ],
    "key_contributions": [
      "1. **Controllable Image Generation**: Developed methodologies that improve the controllability of image generation models, allowing for more precise user input and customization.",
      "2. **Personalized Video Synthesis**: Contributed to advancements in video synthesis technology that adapts to user preferences, enhancing the personalization aspect of video content creation."
    ],
    "research_cluster": "Multimodal AI & Vision",
    "impact_summary": "Nataniel Ruiz has significantly influenced the field of generative models by focusing on making these models more controllable and personalized. His work at Google DeepMind has led to the development of systems that enhance user interaction with AI, making generative technologies more accessible and useful in practical applications. His contributions have been recognized for pushing the boundaries of how generative models can be applied in innovative ways, particularly in the realm of image and video synthesis."
  },
  {
    "researcher_name": "Christopher Richardson",
    "researcher_title": "Research Scientist @ Google DeepMind",
    "researcher_company": "Google DeepMind",
    "linkedin_url": "https://www.linkedin.com/in/christopher-richardson-b9690293",
    "google_scholar": null,
    "total_publications": 0,
    "analysis": "## Core Research Domain\nChristopher Richardson's primary research focus is on natural language processing (NLP) and virtual assistant technology, aiming to enhance the intelligence, flexibility, interactivity, and immersiveness of virtual AI systems.\n\n## Research Expertise\n- **Natural Language Processing (NLP)**: Specializes in developing algorithms and models that improve language understanding and generation.\n- **Virtual Assistant Technology**: Focuses on creating more interactive and intelligent virtual assistants.\n- **Human-Computer Interaction (HCI)**: Works on improving the interaction between humans and AI systems to make them more user-friendly and effective.\n\n## Key Contributions\n1. **Development of Advanced NLP Models**: Contributed to the creation of models that enhance the language understanding capabilities of virtual assistants, making them more responsive and context-aware.\n2. **Interactive Virtual Assistant Framework**: Worked on a framework that allows virtual assistants to engage in more natural and immersive interactions with users.\n\n## Research Cluster\nNatural Language Processing & Virtual Assistants\n\n## Impact Summary\nChristopher Richardson has significantly influenced the field of virtual assistant technology by advancing the capabilities of NLP models, thereby improving the interactivity and intelligence of AI systems. His work at Google DeepMind and as a PhD candidate at Georgia Tech has contributed to the development of more sophisticated virtual assistants, which are crucial in the evolution of human-computer interaction. His research is recognized for pushing the boundaries of how virtual assistants can understand and respond to human language, making them more effective tools in everyday life.",
    "analyzed_at": "2025-11-22T21:44:39.433493",
    "model_used": "gpt-4o",
    "core_domain": "Christopher Richardson's primary research focus is on natural language processing (NLP) and virtual assistant technology, aiming to enhance the intelligence, flexibility, interactivity, and immersiveness of virtual AI systems.",
    "expertise_areas": [
      "**Natural Language Processing (NLP)**: Specializes in developing algorithms and models that improve language understanding and generation.",
      "**Virtual Assistant Technology**: Focuses on creating more interactive and intelligent virtual assistants.",
      "**Human-Computer Interaction (HCI)**: Works on improving the interaction between humans and AI systems to make them more user-friendly and effective."
    ],
    "key_contributions": [
      "1. **Development of Advanced NLP Models**: Contributed to the creation of models that enhance the language understanding capabilities of virtual assistants, making them more responsive and context-aware.",
      "2. **Interactive Virtual Assistant Framework**: Worked on a framework that allows virtual assistants to engage in more natural and immersive interactions with users."
    ],
    "research_cluster": "Natural Language Processing & Virtual Assistants",
    "impact_summary": "Christopher Richardson has significantly influenced the field of virtual assistant technology by advancing the capabilities of NLP models, thereby improving the interactivity and intelligence of AI systems. His work at Google DeepMind and as a PhD candidate at Georgia Tech has contributed to the development of more sophisticated virtual assistants, which are crucial in the evolution of human-computer interaction. His research is recognized for pushing the boundaries of how virtual assistants can understand and respond to human language, making them more effective tools in everyday life."
  },
  {
    "researcher_name": "Alireza Makhzani",
    "researcher_title": "Research Scientist at Google DeepMind",
    "researcher_company": "Google DeepMind",
    "linkedin_url": "https://www.linkedin.com/in/amakhzani",
    "google_scholar": null,
    "total_publications": 0,
    "analysis": "## Core Research Domain\nAlireza Makhzani primarily focuses on generative models and unsupervised learning, with a strong emphasis on developing innovative neural network architectures and algorithms that enhance the efficiency and capability of machine learning systems.\n\n## Research Expertise\n- **Generative Adversarial Networks (GANs)**: Expertise in developing and improving GAN architectures for better training stability and performance.\n- **Variational Autoencoders (VAEs)**: Specializes in designing VAEs for efficient representation learning and data generation.\n- **Neural Network Architectures**: Proficient in creating novel neural architectures that improve learning efficiency and scalability.\n- **Unsupervised Learning**: Focuses on methods that enable machines to learn patterns and representations from unlabeled data.\n\n## Key Contributions\n1. **Adversarial Autoencoders**: Developed the adversarial autoencoder framework, which combines GANs with autoencoders to perform variational inference and generate high-quality data representations.\n2. **Capsule Networks**: Contributed to the development of capsule networks, which aim to improve the way neural networks model spatial hierarchies and relationships in data.\n\n## Research Cluster\n\"Generative Models & Unsupervised Learning\"\n\n## Impact Summary\nAlireza Makhzani has significantly influenced the field of generative models through his pioneering work on adversarial autoencoders, which has been widely adopted for tasks requiring efficient representation learning. His contributions to capsule networks have also sparked interest in alternative neural architectures that better capture spatial hierarchies, influencing subsequent research in the area. As a research scientist at Google DeepMind and a faculty member at the Vector Institute, he continues to push the boundaries of unsupervised learning and generative modeling, contributing to the advancement of AI technologies.",
    "analyzed_at": "2025-11-22T21:45:35.107140",
    "model_used": "gpt-4o",
    "core_domain": "Alireza Makhzani primarily focuses on generative models and unsupervised learning, with a strong emphasis on developing innovative neural network architectures and algorithms that enhance the efficiency and capability of machine learning systems.",
    "expertise_areas": [
      "**Generative Adversarial Networks (GANs)**: Expertise in developing and improving GAN architectures for better training stability and performance.",
      "**Variational Autoencoders (VAEs)**: Specializes in designing VAEs for efficient representation learning and data generation.",
      "**Neural Network Architectures**: Proficient in creating novel neural architectures that improve learning efficiency and scalability.",
      "**Unsupervised Learning**: Focuses on methods that enable machines to learn patterns and representations from unlabeled data."
    ],
    "key_contributions": [
      "1. **Adversarial Autoencoders**: Developed the adversarial autoencoder framework, which combines GANs with autoencoders to perform variational inference and generate high-quality data representations.",
      "2. **Capsule Networks**: Contributed to the development of capsule networks, which aim to improve the way neural networks model spatial hierarchies and relationships in data."
    ],
    "research_cluster": "\"Generative Models & Unsupervised Learning\"",
    "impact_summary": "Alireza Makhzani has significantly influenced the field of generative models through his pioneering work on adversarial autoencoders, which has been widely adopted for tasks requiring efficient representation learning. His contributions to capsule networks have also sparked interest in alternative neural architectures that better capture spatial hierarchies, influencing subsequent research in the area. As a research scientist at Google DeepMind and a faculty member at the Vector Institute, he continues to push the boundaries of unsupervised learning and generative modeling, contributing to the advancement of AI technologies."
  },
  {
    "researcher_name": "Wittawat Jitkrittum",
    "researcher_title": "Research Scientist at Google",
    "researcher_company": "Google DeepMind",
    "linkedin_url": "https://www.linkedin.com/in/wittawat-jitkrittum",
    "google_scholar": "https://scholar.google.com/scholar?q=Wittawat+Jitkrittum",
    "total_publications": 10,
    "analysis": "## Core Research Domain\nWittawat Jitkrittum primarily focuses on the intersection of theoretical and practical machine learning, with a strong emphasis on kernel methods, nonparametric statistical tests, and their applications in deep learning and generative models.\n\n## Research Expertise\n- **Kernel Methods**: Specializes in developing and applying kernel-based techniques for statistical testing and model evaluation.\n- **Nonparametric Statistical Tests**: Expertise in designing tests that do not assume a specific data distribution, useful for model criticism and comparison.\n- **Deep Learning and GANs**: Works on the practical aspects of deep learning, including the development and evaluation of generative adversarial networks (GANs).\n- **Model Criticism and Comparison**: Focuses on methods to assess and compare machine learning models, ensuring robustness and reliability.\n- **Statistical Learning Theory**: Engages in theoretical analysis to understand the underpinnings of machine learning algorithms.\n\n## Key Contributions\n1. **Kernel Mean Matching for Content Addressability of GANs**: Developed a method to improve the content addressability of GANs using kernel mean matching, enhancing the ability of GANs to generate specific content.\n2. **A Linear-Time Kernel Goodness-of-Fit Test**: Introduced a novel kernel-based test that operates in linear time, making it feasible for large-scale data applications.\n3. **Informative Features for Model Comparison**: Proposed techniques for identifying and utilizing informative features to effectively compare different machine learning models.\n4. **An Adaptive Test of Independence with Analytic Kernel Embeddings**: Created an adaptive test for independence that leverages analytic kernel embeddings, providing a powerful tool for statistical analysis in machine learning.\n\n## Research Cluster\nStatistical Machine Learning & Model Evaluation\n\n## Impact Summary\nWittawat Jitkrittum has significantly influenced the field of statistical machine learning through his work on kernel methods and nonparametric tests, which are crucial for model evaluation and criticism. His contributions, particularly in developing efficient and scalable statistical tests, have been recognized with awards, including a best paper award at NeurIPS 2017. His research bridges theoretical insights with practical applications, impacting how models are assessed and improved in various AI systems.",
    "analyzed_at": "2025-11-22T21:45:39.951481",
    "model_used": "gpt-4o",
    "core_domain": "Wittawat Jitkrittum primarily focuses on the intersection of theoretical and practical machine learning, with a strong emphasis on kernel methods, nonparametric statistical tests, and their applications in deep learning and generative models.",
    "expertise_areas": [
      "**Kernel Methods**: Specializes in developing and applying kernel-based techniques for statistical testing and model evaluation.",
      "**Nonparametric Statistical Tests**: Expertise in designing tests that do not assume a specific data distribution, useful for model criticism and comparison.",
      "**Deep Learning and GANs**: Works on the practical aspects of deep learning, including the development and evaluation of generative adversarial networks (GANs).",
      "**Model Criticism and Comparison**: Focuses on methods to assess and compare machine learning models, ensuring robustness and reliability.",
      "**Statistical Learning Theory**: Engages in theoretical analysis to understand the underpinnings of machine learning algorithms."
    ],
    "key_contributions": [
      "1. **Kernel Mean Matching for Content Addressability of GANs**: Developed a method to improve the content addressability of GANs using kernel mean matching, enhancing the ability of GANs to generate specific content.",
      "2. **A Linear-Time Kernel Goodness-of-Fit Test**: Introduced a novel kernel-based test that operates in linear time, making it feasible for large-scale data applications.",
      "3. **Informative Features for Model Comparison**: Proposed techniques for identifying and utilizing informative features to effectively compare different machine learning models.",
      "4. **An Adaptive Test of Independence with Analytic Kernel Embeddings**: Created an adaptive test for independence that leverages analytic kernel embeddings, providing a powerful tool for statistical analysis in machine learning."
    ],
    "research_cluster": "Statistical Machine Learning & Model Evaluation",
    "impact_summary": "Wittawat Jitkrittum has significantly influenced the field of statistical machine learning through his work on kernel methods and nonparametric tests, which are crucial for model evaluation and criticism. His contributions, particularly in developing efficient and scalable statistical tests, have been recognized with awards, including a best paper award at NeurIPS 2017. His research bridges theoretical insights with practical applications, impacting how models are assessed and improved in various AI systems."
  },
  {
    "researcher_name": "Eliot Hijano",
    "researcher_title": "AI and ML",
    "researcher_company": "Google DeepMind",
    "linkedin_url": "https://www.linkedin.com/in/ehijano",
    "google_scholar": "https://scholar.google.com/scholar?q=Eliot+Hijano",
    "total_publications": 10,
    "analysis": "## Core Research Domain\nEliot Hijano's primary research focus is on the intersection of theoretical physics and machine learning, particularly exploring the mathematical structures and geometries underlying quantum field theories and their applications in AI and data science.\n\n## Research Expertise\n- **Conformal Field Theory**: Specializes in the study of conformal blocks and their semiclassical approximations in the context of AdS/CFT correspondence.\n- **Quantum Gravity**: Expertise in the geometric aspects of quantum gravity, particularly in lower-dimensional models like AdS3.\n- **Entanglement Entropy**: Investigates the role of entanglement in quantum systems and its implications for information theory.\n\n## Key Contributions\n1. **Semiclassical Virasoro Blocks from AdS3 Gravity**: Developed a framework for understanding Virasoro blocks using semiclassical approximations in AdS3, contributing to the deeper understanding of the AdS/CFT correspondence.\n2. **Witten Diagrams Revisited**: Provided new insights into the geometry of conformal blocks through the lens of Witten diagrams, enhancing the comprehension of holographic dualities.\n\n## Research Cluster\nTheoretical Physics & Quantum Information\n\n## Impact Summary\nEliot Hijano has significantly contributed to the theoretical understanding of quantum field theories and their geometric representations, particularly in the context of the AdS/CFT correspondence. His work bridges the gap between abstract mathematical concepts and their practical implications in AI and data science, influencing both theoretical physics and interdisciplinary applications. While his primary focus remains on theoretical physics, his insights have potential applications in AI, particularly in areas requiring advanced mathematical modeling and data analysis.",
    "analyzed_at": "2025-11-22T21:45:44.427170",
    "model_used": "gpt-4o",
    "core_domain": "Eliot Hijano's primary research focus is on the intersection of theoretical physics and machine learning, particularly exploring the mathematical structures and geometries underlying quantum field theories and their applications in AI and data science.",
    "expertise_areas": [
      "**Conformal Field Theory**: Specializes in the study of conformal blocks and their semiclassical approximations in the context of AdS/CFT correspondence.",
      "**Quantum Gravity**: Expertise in the geometric aspects of quantum gravity, particularly in lower-dimensional models like AdS3.",
      "**Entanglement Entropy**: Investigates the role of entanglement in quantum systems and its implications for information theory."
    ],
    "key_contributions": [
      "1. **Semiclassical Virasoro Blocks from AdS3 Gravity**: Developed a framework for understanding Virasoro blocks using semiclassical approximations in AdS3, contributing to the deeper understanding of the AdS/CFT correspondence.",
      "2. **Witten Diagrams Revisited**: Provided new insights into the geometry of conformal blocks through the lens of Witten diagrams, enhancing the comprehension of holographic dualities."
    ],
    "research_cluster": "Theoretical Physics & Quantum Information",
    "impact_summary": "Eliot Hijano has significantly contributed to the theoretical understanding of quantum field theories and their geometric representations, particularly in the context of the AdS/CFT correspondence. His work bridges the gap between abstract mathematical concepts and their practical implications in AI and data science, influencing both theoretical physics and interdisciplinary applications. While his primary focus remains on theoretical physics, his insights have potential applications in AI, particularly in areas requiring advanced mathematical modeling and data analysis."
  },
  {
    "researcher_name": "Will Dabney",
    "researcher_title": "Research Team Lead at DeepMind",
    "researcher_company": "DeepMind",
    "linkedin_url": "https://www.linkedin.com/in/will-dabney-743377ba",
    "google_scholar": "https://scholar.google.com/scholar?q=Will+Dabney",
    "total_publications": 4,
    "analysis": "## Core Research Domain\nWill Dabney primarily focuses on reinforcement learning, with a strong emphasis on developing and refining algorithms for temporal difference learning and actor-critic methods. His work often bridges theoretical advancements with practical implementations in machine learning systems.\n\n## Research Expertise\n- **Reinforcement Learning**: Specializes in temporal difference learning and actor-critic methods, contributing to both theoretical and applied aspects.\n- **Adaptive Learning Algorithms**: Expertise in developing adaptive step-size methods to enhance the efficiency and performance of learning algorithms.\n- **Relational Reinforcement Learning**: Focuses on utilizing utile distinctions to improve relational learning frameworks.\n- **Natural Gradient Methods**: Applies natural gradient techniques to reinforcement learning for more stable and efficient learning processes.\n\n## Key Contributions\n1. **Natural Temporal Difference Learning**: Developed methods that incorporate natural gradients into temporal difference learning, improving convergence properties and stability.\n2. **Adaptive Step-Size for Online Temporal Difference Learning**: Introduced adaptive step-size mechanisms that allow for more robust and efficient learning in dynamic environments.\n3. **Utile Distinctions for Relational Reinforcement Learning**: Proposed a framework for enhancing relational reinforcement learning by identifying and leveraging useful distinctions in relational data.\n4. **Projected Natural Actor-Critic**: Advanced the actor-critic framework by integrating projected natural gradient methods, leading to improved performance in complex reinforcement learning tasks.\n\n## Research Cluster\nReinforcement Learning & Robotics\n\n## Impact Summary\nWill Dabney is a prominent figure in the reinforcement learning community, recognized for his contributions to improving the stability and efficiency of learning algorithms. His work on adaptive learning rates and natural gradient methods has significantly influenced the development of more robust reinforcement learning systems. As a Research Team Lead at DeepMind, he plays a crucial role in advancing state-of-the-art AI technologies, bridging theoretical insights with practical applications in complex environments. His research continues to shape the future of reinforcement learning, particularly in the context of scalable and adaptive AI systems.",
    "analyzed_at": "2025-11-22T21:45:49.060795",
    "model_used": "gpt-4o",
    "core_domain": "Will Dabney primarily focuses on reinforcement learning, with a strong emphasis on developing and refining algorithms for temporal difference learning and actor-critic methods. His work often bridges theoretical advancements with practical implementations in machine learning systems.",
    "expertise_areas": [
      "**Reinforcement Learning**: Specializes in temporal difference learning and actor-critic methods, contributing to both theoretical and applied aspects.",
      "**Adaptive Learning Algorithms**: Expertise in developing adaptive step-size methods to enhance the efficiency and performance of learning algorithms.",
      "**Relational Reinforcement Learning**: Focuses on utilizing utile distinctions to improve relational learning frameworks.",
      "**Natural Gradient Methods**: Applies natural gradient techniques to reinforcement learning for more stable and efficient learning processes."
    ],
    "key_contributions": [
      "1. **Natural Temporal Difference Learning**: Developed methods that incorporate natural gradients into temporal difference learning, improving convergence properties and stability.",
      "2. **Adaptive Step-Size for Online Temporal Difference Learning**: Introduced adaptive step-size mechanisms that allow for more robust and efficient learning in dynamic environments.",
      "3. **Utile Distinctions for Relational Reinforcement Learning**: Proposed a framework for enhancing relational reinforcement learning by identifying and leveraging useful distinctions in relational data.",
      "4. **Projected Natural Actor-Critic**: Advanced the actor-critic framework by integrating projected natural gradient methods, leading to improved performance in complex reinforcement learning tasks."
    ],
    "research_cluster": "Reinforcement Learning & Robotics",
    "impact_summary": "Will Dabney is a prominent figure in the reinforcement learning community, recognized for his contributions to improving the stability and efficiency of learning algorithms. His work on adaptive learning rates and natural gradient methods has significantly influenced the development of more robust reinforcement learning systems. As a Research Team Lead at DeepMind, he plays a crucial role in advancing state-of-the-art AI technologies, bridging theoretical insights with practical applications in complex environments. His research continues to shape the future of reinforcement learning, particularly in the context of scalable and adaptive AI systems."
  },
  {
    "researcher_name": "Aditi Chaudhary",
    "researcher_title": "Research Scientist",
    "researcher_company": "Google DeepMind",
    "linkedin_url": "https://www.linkedin.com/in/aditi-chaudhary",
    "google_scholar": "https://scholar.google.com/scholar?q=Aditi+Chaudhary",
    "total_publications": 2,
    "analysis": "## Core Research Domain\nAditi Chaudhary's primary research focus is on Natural Language Processing (NLP) with a specialization in handling low-resource languages, leveraging machine learning techniques to enhance language understanding and information retrieval.\n\n## Research Expertise\n- **Low-Resource Language Processing**: Developing methodologies to improve NLP capabilities for languages with limited data resources.\n- **Crosslingual Morphology**: Expertise in adapting language models to understand and process morphological and phonological aspects across different languages.\n- **Information Retrieval**: Enhancing search engine features and retrieval systems, as evidenced by her work at Microsoft Bing.\n\n## Key Contributions\n1. **SIGMORPHON 2019 Shared Task**: Contributed to the development of models for crosslinguality and context in morphology, advancing the understanding of language structures across different linguistic contexts.\n2. **Word Embedding Adaptation**: Developed techniques for adapting word embeddings to new languages using subword representations, which aids in better language model performance in multilingual settings.\n\n## Research Cluster\nNatural Language Processing & Low-Resource Language Technologies\n\n## Impact Summary\nAditi Chaudhary has made significant strides in the field of NLP, particularly in addressing the challenges associated with low-resource languages. Her work on adapting word embeddings and crosslingual morphology has contributed to more inclusive and effective language models. Her role at Google DeepMind positions her at the forefront of AI research, where she continues to influence the development of advanced NLP systems and methodologies. Her background in both academia and industry, including her contributions to Bing Search, underscores her ability to bridge theoretical research with practical applications.",
    "analyzed_at": "2025-11-22T21:45:52.531071",
    "model_used": "gpt-4o",
    "core_domain": "Aditi Chaudhary's primary research focus is on Natural Language Processing (NLP) with a specialization in handling low-resource languages, leveraging machine learning techniques to enhance language understanding and information retrieval.",
    "expertise_areas": [
      "**Low-Resource Language Processing**: Developing methodologies to improve NLP capabilities for languages with limited data resources.",
      "**Crosslingual Morphology**: Expertise in adapting language models to understand and process morphological and phonological aspects across different languages.",
      "**Information Retrieval**: Enhancing search engine features and retrieval systems, as evidenced by her work at Microsoft Bing."
    ],
    "key_contributions": [
      "1. **SIGMORPHON 2019 Shared Task**: Contributed to the development of models for crosslinguality and context in morphology, advancing the understanding of language structures across different linguistic contexts.",
      "2. **Word Embedding Adaptation**: Developed techniques for adapting word embeddings to new languages using subword representations, which aids in better language model performance in multilingual settings."
    ],
    "research_cluster": "Natural Language Processing & Low-Resource Language Technologies",
    "impact_summary": "Aditi Chaudhary has made significant strides in the field of NLP, particularly in addressing the challenges associated with low-resource languages. Her work on adapting word embeddings and crosslingual morphology has contributed to more inclusive and effective language models. Her role at Google DeepMind positions her at the forefront of AI research, where she continues to influence the development of advanced NLP systems and methodologies. Her background in both academia and industry, including her contributions to Bing Search, underscores her ability to bridge theoretical research with practical applications."
  },
  {
    "researcher_name": "Devendra Singh Sachan",
    "researcher_title": "Google DeepMind",
    "researcher_company": "Google DeepMind",
    "linkedin_url": "https://www.linkedin.com/in/devendra-singh-sachan-72985216",
    "google_scholar": "https://scholar.google.com/scholar?q=Devendra+Singh+Sachan",
    "total_publications": 4,
    "analysis": "## Core Research Domain\nDevendra Singh Sachan primarily focuses on Machine Learning and Natural Language Processing, with a particular interest in how pre-trained models and multimodal data can enhance tasks such as neural machine translation and video classification.\n\n## Research Expertise\n- **Neural Machine Translation**: Investigating the utility of pre-trained word embeddings in improving translation models.\n- **Multimodal AI**: Developing methods for integrating and processing multimodal information, particularly in the context of video classification.\n- **Optical Character Recognition (OCR)**: Working on OCR technologies, especially for complex scripts like Devanagari and Malayalam, including handling degraded text.\n\n## Key Contributions\n1. **Pre-trained Word Embeddings in NMT**: Explored the conditions under which pre-trained word embeddings are beneficial for neural machine translation, contributing to a better understanding of transfer learning in NLP.\n2. **Multimodal Sports Video Classification**: Developed deep neural network models that leverage multimodal information for classifying sports videos, advancing the field of video understanding.\n3. **reCAPTCHA Assisted OCR**: Worked on enhancing OCR systems for Devanagari texts using reCAPTCHA, improving text recognition accuracy for complex scripts.\n4. **Segmentation of Degraded Malayalam Words**: Proposed and evaluated methods for segmenting degraded Malayalam text, contributing to the field of document analysis and recognition.\n\n## Research Cluster\nMultimodal AI & Vision\n\n## Impact Summary\nDevendra Singh Sachan has made significant contributions to the integration of multimodal data in AI systems, particularly in enhancing video classification and text recognition technologies. His work on leveraging pre-trained models for neural machine translation has provided valuable insights into the practical applications of transfer learning in NLP. At Google DeepMind, he continues to push the boundaries of multimodal AI, influencing both academic research and practical implementations in AI systems. His research has been recognized for addressing complex challenges in OCR and video analysis, particularly for underrepresented languages and scripts.",
    "analyzed_at": "2025-11-22T21:45:57.351947",
    "model_used": "gpt-4o",
    "core_domain": "Devendra Singh Sachan primarily focuses on Machine Learning and Natural Language Processing, with a particular interest in how pre-trained models and multimodal data can enhance tasks such as neural machine translation and video classification.",
    "expertise_areas": [
      "**Neural Machine Translation**: Investigating the utility of pre-trained word embeddings in improving translation models.",
      "**Multimodal AI**: Developing methods for integrating and processing multimodal information, particularly in the context of video classification.",
      "**Optical Character Recognition (OCR)**: Working on OCR technologies, especially for complex scripts like Devanagari and Malayalam, including handling degraded text."
    ],
    "key_contributions": [
      "1. **Pre-trained Word Embeddings in NMT**: Explored the conditions under which pre-trained word embeddings are beneficial for neural machine translation, contributing to a better understanding of transfer learning in NLP.",
      "2. **Multimodal Sports Video Classification**: Developed deep neural network models that leverage multimodal information for classifying sports videos, advancing the field of video understanding.",
      "3. **reCAPTCHA Assisted OCR**: Worked on enhancing OCR systems for Devanagari texts using reCAPTCHA, improving text recognition accuracy for complex scripts.",
      "4. **Segmentation of Degraded Malayalam Words**: Proposed and evaluated methods for segmenting degraded Malayalam text, contributing to the field of document analysis and recognition."
    ],
    "research_cluster": "Multimodal AI & Vision",
    "impact_summary": "Devendra Singh Sachan has made significant contributions to the integration of multimodal data in AI systems, particularly in enhancing video classification and text recognition technologies. His work on leveraging pre-trained models for neural machine translation has provided valuable insights into the practical applications of transfer learning in NLP. At Google DeepMind, he continues to push the boundaries of multimodal AI, influencing both academic research and practical implementations in AI systems. His research has been recognized for addressing complex challenges in OCR and video analysis, particularly for underrepresented languages and scripts."
  },
  {
    "researcher_name": "Ashkan Khakzar",
    "researcher_title": "Thinking about thinking",
    "researcher_company": "Google DeepMind",
    "linkedin_url": "https://www.linkedin.com/in/ashkankhakzar",
    "google_scholar": "https://scholar.google.com/scholar?q=Ashkan+Khakzar",
    "total_publications": 10,
    "analysis": "## Core Research Domain\nAshkan Khakzar primarily focuses on explainable AI (XAI) and its applications in medical imaging, particularly in understanding and interpreting neural network predictions in the context of healthcare diagnostics.\n\n## Research Expertise\n- **Explainable AI (XAI)**: Developing methods to elucidate the decision-making processes of neural networks by identifying key input features that contribute to predictions.\n- **Medical Imaging Analysis**: Specializing in the interpretation of thoracic disease and COVID-19 diagnostics through advanced AI models.\n- **Neural Network Interpretation**: Investigating neural response pathways to provide insights into model behavior and prediction reliability.\n\n## Key Contributions\n1. **Fine-Grained Neural Network Explanation**: Developed techniques to identify input features with significant predictive information, enhancing the transparency of AI models.\n2. **COVID-19 and Thoracic Pathology Model Interpretation**: Advanced the understanding of AI model predictions in medical imaging, particularly for COVID-19, by identifying informative features and pathways.\n3. **Longitudinal Assessment of COVID-19 Progression**: Contributed to the quantitative evaluation of COVID-19 infection progression using chest CT scans, aiding in better clinical decision-making.\n\n## Research Cluster\nMultimodal AI & Vision\n\n## Impact Summary\nAshkan Khakzar has significantly contributed to the field of explainable AI, particularly in the medical domain, by developing methodologies that enhance the interpretability of complex neural networks. His work on COVID-19 and thoracic disease models has provided valuable insights into the diagnostic capabilities of AI, promoting trust and reliability in AI-assisted healthcare. His research has been instrumental in bridging the gap between AI model predictions and clinical applicability, ensuring that AI tools are both effective and transparent.",
    "analyzed_at": "2025-11-22T21:46:02.236008",
    "model_used": "gpt-4o",
    "core_domain": "Ashkan Khakzar primarily focuses on explainable AI (XAI) and its applications in medical imaging, particularly in understanding and interpreting neural network predictions in the context of healthcare diagnostics.",
    "expertise_areas": [
      "**Explainable AI (XAI)**: Developing methods to elucidate the decision-making processes of neural networks by identifying key input features that contribute to predictions.",
      "**Medical Imaging Analysis**: Specializing in the interpretation of thoracic disease and COVID-19 diagnostics through advanced AI models.",
      "**Neural Network Interpretation**: Investigating neural response pathways to provide insights into model behavior and prediction reliability."
    ],
    "key_contributions": [
      "1. **Fine-Grained Neural Network Explanation**: Developed techniques to identify input features with significant predictive information, enhancing the transparency of AI models.",
      "2. **COVID-19 and Thoracic Pathology Model Interpretation**: Advanced the understanding of AI model predictions in medical imaging, particularly for COVID-19, by identifying informative features and pathways.",
      "3. **Longitudinal Assessment of COVID-19 Progression**: Contributed to the quantitative evaluation of COVID-19 infection progression using chest CT scans, aiding in better clinical decision-making."
    ],
    "research_cluster": "Multimodal AI & Vision",
    "impact_summary": "Ashkan Khakzar has significantly contributed to the field of explainable AI, particularly in the medical domain, by developing methodologies that enhance the interpretability of complex neural networks. His work on COVID-19 and thoracic disease models has provided valuable insights into the diagnostic capabilities of AI, promoting trust and reliability in AI-assisted healthcare. His research has been instrumental in bridging the gap between AI model predictions and clinical applicability, ensuring that AI tools are both effective and transparent."
  },
  {
    "researcher_name": "Shixiang Shane Gu",
    "researcher_title": "Senior Staff Research Scientist at Google DeepMind",
    "researcher_company": "Google DeepMind",
    "linkedin_url": "https://www.linkedin.com/in/shixiang-shane-gu-91084129",
    "google_scholar": "https://scholar.google.com/scholar?q=Shixiang+Shane+Gu",
    "total_publications": 10,
    "analysis": "## Core Research Domain\nShixiang Shane Gu's primary research focus is on developing sample-efficient reinforcement learning (RL) methods that can be effectively applied to complex continuous control problems, particularly in the context of robotics and probabilistic machine learning.\n\n## Research Expertise\n- **Reinforcement Learning**: Specializes in both on-policy and off-policy RL methods, with a focus on improving sample efficiency.\n- **Robotics**: Applies deep learning and RL techniques to robotic manipulation tasks, enhancing real-world applicability.\n- **Probabilistic Machine Learning**: Utilizes probabilistic models to inform and improve machine learning algorithms, particularly in RL contexts.\n- **Deep Learning**: Integrates deep learning methodologies to enhance the performance and scalability of RL systems.\n\n## Key Contributions\n1. **Categorical Reparametrization with Gumbel-Softmax**: Developed a technique to enable gradient-based optimization of discrete variables, which is crucial for training models with discrete latent variables.\n2. **Q-Prop: Sample-Efficient Policy Gradient with An Off-Policy Critic**: Introduced a novel approach that combines on-policy and off-policy learning to improve the sample efficiency of policy gradient methods in RL.\n3. **Deep Reinforcement Learning for Robotic Manipulation with Asynchronous Off-Policy Updates**: Advanced the field of robotic manipulation by developing asynchronous off-policy updates, which enhance the efficiency and effectiveness of RL in robotics.\n\n## Research Cluster\nReinforcement Learning & Robotics\n\n## Impact Summary\nShixiang Shane Gu has significantly influenced the field of reinforcement learning, particularly in the development of methods that enhance sample efficiency and applicability to real-world continuous control problems. His work on the Gumbel-Softmax technique has been widely recognized for its utility in optimizing discrete variables, impacting various applications in machine learning. Additionally, his contributions to robotic manipulation have advanced the integration of RL in practical robotics, demonstrating the potential for RL to solve complex tasks in dynamic environments. His research has been featured in prominent platforms such as the Google Research Blog and MIT Technology Review, underscoring his role as a leading figure in frontier AI research.",
    "analyzed_at": "2025-11-22T21:46:08.503208",
    "model_used": "gpt-4o",
    "core_domain": "Shixiang Shane Gu's primary research focus is on developing sample-efficient reinforcement learning (RL) methods that can be effectively applied to complex continuous control problems, particularly in the context of robotics and probabilistic machine learning.",
    "expertise_areas": [
      "**Reinforcement Learning**: Specializes in both on-policy and off-policy RL methods, with a focus on improving sample efficiency.",
      "**Robotics**: Applies deep learning and RL techniques to robotic manipulation tasks, enhancing real-world applicability.",
      "**Probabilistic Machine Learning**: Utilizes probabilistic models to inform and improve machine learning algorithms, particularly in RL contexts.",
      "**Deep Learning**: Integrates deep learning methodologies to enhance the performance and scalability of RL systems."
    ],
    "key_contributions": [
      "1. **Categorical Reparametrization with Gumbel-Softmax**: Developed a technique to enable gradient-based optimization of discrete variables, which is crucial for training models with discrete latent variables.",
      "2. **Q-Prop: Sample-Efficient Policy Gradient with An Off-Policy Critic**: Introduced a novel approach that combines on-policy and off-policy learning to improve the sample efficiency of policy gradient methods in RL.",
      "3. **Deep Reinforcement Learning for Robotic Manipulation with Asynchronous Off-Policy Updates**: Advanced the field of robotic manipulation by developing asynchronous off-policy updates, which enhance the efficiency and effectiveness of RL in robotics."
    ],
    "research_cluster": "Reinforcement Learning & Robotics",
    "impact_summary": "Shixiang Shane Gu has significantly influenced the field of reinforcement learning, particularly in the development of methods that enhance sample efficiency and applicability to real-world continuous control problems. His work on the Gumbel-Softmax technique has been widely recognized for its utility in optimizing discrete variables, impacting various applications in machine learning. Additionally, his contributions to robotic manipulation have advanced the integration of RL in practical robotics, demonstrating the potential for RL to solve complex tasks in dynamic environments. His research has been featured in prominent platforms such as the Google Research Blog and MIT Technology Review, underscoring his role as a leading figure in frontier AI research."
  },
  {
    "researcher_name": "Shrinu Kushagra",
    "researcher_title": "Learning about stuff",
    "researcher_company": "Google DeepMind",
    "linkedin_url": "https://www.linkedin.com/in/shrinu-kushagra-1ab73731",
    "google_scholar": "https://scholar.google.com/scholar?q=Shrinu+Kushagra",
    "total_publications": 5,
    "analysis": "## Core Research Domain\nShrinu Kushagra's primary research focus lies in clustering algorithms and dimensionality reduction techniques, with a strong emphasis on developing methods that can handle real-world data complexities such as noise and high dimensionality.\n\n## Research Expertise\n- **Clustering Algorithms**: Specializes in developing and refining clustering techniques, particularly those that can discern meaningful structures amidst noise.\n- **Dimensionality Reduction**: Expertise in creating methods that preserve information while reducing the dimensionality of data, facilitating more efficient data processing and analysis.\n- **Algorithmic Theory and Experimentation**: Proficient in both the theoretical development and experimental validation of algorithms, such as multi-pivot quicksort.\n- **Sensory Data Processing**: Skilled in developing methods to improve sensory data interpretation, particularly in contexts where path integration drift is a concern.\n\n## Key Contributions\n1. **Clustering using Same-Cluster Queries**: Developed innovative clustering methods that leverage same-cluster queries to enhance the accuracy and efficiency of clustering processes.\n2. **Information Preserving Dimensionality Reduction**: Contributed to the field of dimensionality reduction by creating techniques that maintain the integrity of the original data's information content.\n3. **Multi-Pivot Quicksort: Theory and Experiments**: Advanced sorting algorithm research by exploring the theoretical and practical aspects of multi-pivot quicksort, demonstrating its benefits over traditional methods.\n4. **Sensory Updates to Combat Path-Integration Drift**: Proposed solutions to address path-integration drift in sensory systems, improving the reliability of sensory data interpretation.\n\n## Research Cluster\n\"Algorithmic Development & Data Processing\"\n\n## Impact Summary\nShrinu Kushagra has significantly influenced the field of algorithmic development, particularly in clustering and dimensionality reduction, by addressing challenges related to noise and data complexity. His work on multi-pivot quicksort has contributed to both theoretical and practical advancements in sorting algorithms. Additionally, his research on sensory data processing has implications for improving the accuracy of systems reliant on path integration. Through his contributions, Kushagra has demonstrated a strong ability to bridge theoretical insights with practical applications, enhancing the robustness and efficiency of AI systems in handling complex data environments.",
    "analyzed_at": "2025-11-22T21:46:15.493031",
    "model_used": "gpt-4o",
    "core_domain": "Shrinu Kushagra's primary research focus lies in clustering algorithms and dimensionality reduction techniques, with a strong emphasis on developing methods that can handle real-world data complexities such as noise and high dimensionality.",
    "expertise_areas": [
      "**Clustering Algorithms**: Specializes in developing and refining clustering techniques, particularly those that can discern meaningful structures amidst noise.",
      "**Dimensionality Reduction**: Expertise in creating methods that preserve information while reducing the dimensionality of data, facilitating more efficient data processing and analysis.",
      "**Algorithmic Theory and Experimentation**: Proficient in both the theoretical development and experimental validation of algorithms, such as multi-pivot quicksort.",
      "**Sensory Data Processing**: Skilled in developing methods to improve sensory data interpretation, particularly in contexts where path integration drift is a concern."
    ],
    "key_contributions": [
      "1. **Clustering using Same-Cluster Queries**: Developed innovative clustering methods that leverage same-cluster queries to enhance the accuracy and efficiency of clustering processes.",
      "2. **Information Preserving Dimensionality Reduction**: Contributed to the field of dimensionality reduction by creating techniques that maintain the integrity of the original data's information content.",
      "3. **Multi-Pivot Quicksort: Theory and Experiments**: Advanced sorting algorithm research by exploring the theoretical and practical aspects of multi-pivot quicksort, demonstrating its benefits over traditional methods.",
      "4. **Sensory Updates to Combat Path-Integration Drift**: Proposed solutions to address path-integration drift in sensory systems, improving the reliability of sensory data interpretation."
    ],
    "research_cluster": "\"Algorithmic Development & Data Processing\"",
    "impact_summary": "Shrinu Kushagra has significantly influenced the field of algorithmic development, particularly in clustering and dimensionality reduction, by addressing challenges related to noise and data complexity. His work on multi-pivot quicksort has contributed to both theoretical and practical advancements in sorting algorithms. Additionally, his research on sensory data processing has implications for improving the accuracy of systems reliant on path integration. Through his contributions, Kushagra has demonstrated a strong ability to bridge theoretical insights with practical applications, enhancing the robustness and efficiency of AI systems in handling complex data environments."
  },
  {
    "researcher_name": "Angelica Chen",
    "researcher_title": "PhD in ML from NYU, research scientist @ Google DeepMind",
    "researcher_company": "Google DeepMind",
    "linkedin_url": "https://www.linkedin.com/in/angelicachen",
    "google_scholar": "https://scholar.google.com/scholar?q=Angelica+Chen",
    "total_publications": 4,
    "analysis": "## Core Research Domain\nAngelica Chen's primary research focus is on deep learning for natural language processing, with a specialization in generating logical forms and reasoning from text and incomplete information.\n\n## Research Expertise\n- **Natural Language Processing (NLP)**: Expertise in transforming text into structured representations and logical forms.\n- **Deep Learning**: Proficient in applying deep learning techniques to NLP tasks.\n- **Graph Representations**: Skilled in using graph-based methods to represent text and entities for logical reasoning.\n- **Time-Series Analysis**: Experience in analyzing temporal patterns, as evidenced by her work on bacterial meningitis.\n\n## Key Contributions\n1. **Generating Logical Forms from Graph Representations of Text and Entities**: Developed methods to convert textual information into logical forms using graph-based representations, enhancing machine understanding and reasoning capabilities.\n2. **Seasonal Dynamics of Bacterial Meningitis**: Conducted a time-series analysis to understand the patterns and dynamics of bacterial meningitis, contributing to the field of computational epidemiology.\n3. **Reasoning from Radically Incomplete Information: The Case of Containers**: Investigated methods for reasoning and decision-making with incomplete data, which is crucial for AI systems operating in real-world scenarios.\n4. **Development of an Automatic Algorithm for 3-Dimensional Aortic Annular Measurements**: Created an algorithm to predict outcomes for transcatheter aortic valve replacement, showcasing her interdisciplinary approach by bridging AI with medical applications.\n\n## Research Cluster\nMultimodal AI & Vision\n\n## Impact Summary\nAngelica Chen has made significant contributions to the field of natural language processing through her innovative use of graph-based methods for logical reasoning and text representation. Her interdisciplinary work, which spans from computational epidemiology to medical imaging, highlights her versatility and impact across different domains. Recognized early in her career with awards such as the Princeton Innovation 25 Under 25, she continues to influence the field as a research scientist at Google DeepMind, contributing to the advancement of AI systems capable of reasoning and understanding complex information.",
    "analyzed_at": "2025-11-22T21:46:20.655173",
    "model_used": "gpt-4o",
    "core_domain": "Angelica Chen's primary research focus is on deep learning for natural language processing, with a specialization in generating logical forms and reasoning from text and incomplete information.",
    "expertise_areas": [
      "**Natural Language Processing (NLP)**: Expertise in transforming text into structured representations and logical forms.",
      "**Deep Learning**: Proficient in applying deep learning techniques to NLP tasks.",
      "**Graph Representations**: Skilled in using graph-based methods to represent text and entities for logical reasoning.",
      "**Time-Series Analysis**: Experience in analyzing temporal patterns, as evidenced by her work on bacterial meningitis."
    ],
    "key_contributions": [
      "1. **Generating Logical Forms from Graph Representations of Text and Entities**: Developed methods to convert textual information into logical forms using graph-based representations, enhancing machine understanding and reasoning capabilities.",
      "2. **Seasonal Dynamics of Bacterial Meningitis**: Conducted a time-series analysis to understand the patterns and dynamics of bacterial meningitis, contributing to the field of computational epidemiology.",
      "3. **Reasoning from Radically Incomplete Information: The Case of Containers**: Investigated methods for reasoning and decision-making with incomplete data, which is crucial for AI systems operating in real-world scenarios.",
      "4. **Development of an Automatic Algorithm for 3-Dimensional Aortic Annular Measurements**: Created an algorithm to predict outcomes for transcatheter aortic valve replacement, showcasing her interdisciplinary approach by bridging AI with medical applications."
    ],
    "research_cluster": "Multimodal AI & Vision",
    "impact_summary": "Angelica Chen has made significant contributions to the field of natural language processing through her innovative use of graph-based methods for logical reasoning and text representation. Her interdisciplinary work, which spans from computational epidemiology to medical imaging, highlights her versatility and impact across different domains. Recognized early in her career with awards such as the Princeton Innovation 25 Under 25, she continues to influence the field as a research scientist at Google DeepMind, contributing to the advancement of AI systems capable of reasoning and understanding complex information."
  },
  {
    "researcher_name": "Long Zhao",
    "researcher_title": "Senior Research Scientist at Google DeepMind",
    "researcher_company": "Google DeepMind",
    "linkedin_url": "https://www.linkedin.com/in/garyzhao9012",
    "google_scholar": "https://scholar.google.com/citations?user=YTyBTmgAAAAJ",
    "total_publications": 0,
    "analysis": "## Core Research Domain\nLong Zhao's primary research focus is on developing and enhancing large vision foundation models and generative models, with a strong emphasis on multimodal AI and self-supervised learning techniques. His work aims to advance machine perception through innovative methodologies in video-language integration and contextualized recognition systems.\n\n## Research Expertise\n- **Large Vision Foundation Models**: Specializes in video-language models, multimodal models, and world models, contributing to the integration of visual and linguistic data.\n- **Generative Models**: Focuses on diffusion models and visual autoregressive models, advancing the state-of-the-art in generative AI.\n- **Self-Supervised Representation Learning**: Expert in contrastive learning and mask modeling, driving improvements in unsupervised learning paradigms.\n- **Contextualized Machine Perception**: Works on recognition, detection, segmentation, and localization to enhance machine understanding of complex environments.\n\n## Key Contributions\n1. **Development of Video-Language Models**: Contributed to the creation of models that effectively integrate video and language data, improving the understanding and generation of multimodal content.\n2. **Advancements in Diffusion Models**: Played a significant role in enhancing diffusion models, which are crucial for generating high-quality visual content.\n3. **Innovations in Self-Supervised Learning**: Developed novel techniques in contrastive learning and mask modeling, which have been influential in advancing self-supervised learning frameworks.\n\n## Research Cluster\nMultimodal AI & Vision\n\n## Impact Summary\nLong Zhao has significantly influenced the field of multimodal AI through his work on integrating vision and language models, contributing to the development of systems that can understand and generate complex multimodal content. His research in generative models and self-supervised learning has led to advancements in how machines perceive and interact with their environments. As a Senior Research Scientist at Google DeepMind, Zhao is at the forefront of developing cutting-edge AI technologies that push the boundaries of machine perception and understanding. His contributions are recognized for enhancing the capabilities of AI systems in processing and interpreting diverse data modalities.",
    "analyzed_at": "2025-11-22T21:46:26.059713",
    "model_used": "gpt-4o",
    "core_domain": "Long Zhao's primary research focus is on developing and enhancing large vision foundation models and generative models, with a strong emphasis on multimodal AI and self-supervised learning techniques. His work aims to advance machine perception through innovative methodologies in video-language integration and contextualized recognition systems.",
    "expertise_areas": [
      "**Large Vision Foundation Models**: Specializes in video-language models, multimodal models, and world models, contributing to the integration of visual and linguistic data.",
      "**Generative Models**: Focuses on diffusion models and visual autoregressive models, advancing the state-of-the-art in generative AI.",
      "**Self-Supervised Representation Learning**: Expert in contrastive learning and mask modeling, driving improvements in unsupervised learning paradigms.",
      "**Contextualized Machine Perception**: Works on recognition, detection, segmentation, and localization to enhance machine understanding of complex environments."
    ],
    "key_contributions": [
      "1. **Development of Video-Language Models**: Contributed to the creation of models that effectively integrate video and language data, improving the understanding and generation of multimodal content.",
      "2. **Advancements in Diffusion Models**: Played a significant role in enhancing diffusion models, which are crucial for generating high-quality visual content.",
      "3. **Innovations in Self-Supervised Learning**: Developed novel techniques in contrastive learning and mask modeling, which have been influential in advancing self-supervised learning frameworks."
    ],
    "research_cluster": "Multimodal AI & Vision",
    "impact_summary": "Long Zhao has significantly influenced the field of multimodal AI through his work on integrating vision and language models, contributing to the development of systems that can understand and generate complex multimodal content. His research in generative models and self-supervised learning has led to advancements in how machines perceive and interact with their environments. As a Senior Research Scientist at Google DeepMind, Zhao is at the forefront of developing cutting-edge AI technologies that push the boundaries of machine perception and understanding. His contributions are recognized for enhancing the capabilities of AI systems in processing and interpreting diverse data modalities."
  },
  {
    "researcher_name": "Andrew Rosenberg",
    "researcher_title": "Research Scientist at Meta Superintelligence Lab",
    "researcher_company": "Meta",
    "linkedin_url": "https://www.linkedin.com/in/anrosenberg",
    "google_scholar": null,
    "total_publications": 0,
    "analysis": "## Core Research Domain\nAndrew Rosenberg's primary research focus is on advancing the fields of speech recognition and synthesis, with a strong emphasis on integrating these technologies into natural language processing systems to enhance spoken language understanding and interaction.\n\n## Research Expertise\n- **Speech Recognition**: Developing algorithms and models to improve the accuracy and efficiency of converting spoken language into text.\n- **Speech Synthesis**: Creating natural and expressive synthetic speech from text, focusing on prosody and intonation.\n- **Spoken Language Processing**: Enhancing the interaction between humans and machines through improved spoken language understanding and generation techniques.\n\n## Key Contributions\n1. **Advanced Speech Recognition Models**: Developed state-of-the-art models that significantly improve the accuracy of speech-to-text systems, particularly in noisy environments.\n2. **Expressive Speech Synthesis Techniques**: Pioneered methods for generating more natural and human-like synthetic speech, contributing to improved user experiences in virtual assistants and other applications.\n\n## Research Cluster\nSpoken Language Processing & NLP\n\n## Impact Summary\nAndrew Rosenberg has made significant contributions to the field of spoken language processing, particularly in enhancing the naturalness and accuracy of speech recognition and synthesis systems. His work at Meta Superintelligence Lab involves pushing the boundaries of how machines understand and generate human speech, influencing both academic research and practical applications in AI-driven communication technologies. His expertise in programming languages like C++, Java, and Python has facilitated the development of robust and scalable speech processing systems.",
    "analyzed_at": "2025-11-22T21:46:31.340793",
    "model_used": "gpt-4o",
    "core_domain": "Andrew Rosenberg's primary research focus is on advancing the fields of speech recognition and synthesis, with a strong emphasis on integrating these technologies into natural language processing systems to enhance spoken language understanding and interaction.",
    "expertise_areas": [
      "**Speech Recognition**: Developing algorithms and models to improve the accuracy and efficiency of converting spoken language into text.",
      "**Speech Synthesis**: Creating natural and expressive synthetic speech from text, focusing on prosody and intonation.",
      "**Spoken Language Processing**: Enhancing the interaction between humans and machines through improved spoken language understanding and generation techniques."
    ],
    "key_contributions": [
      "1. **Advanced Speech Recognition Models**: Developed state-of-the-art models that significantly improve the accuracy of speech-to-text systems, particularly in noisy environments.",
      "2. **Expressive Speech Synthesis Techniques**: Pioneered methods for generating more natural and human-like synthetic speech, contributing to improved user experiences in virtual assistants and other applications."
    ],
    "research_cluster": "Spoken Language Processing & NLP",
    "impact_summary": "Andrew Rosenberg has made significant contributions to the field of spoken language processing, particularly in enhancing the naturalness and accuracy of speech recognition and synthesis systems. His work at Meta Superintelligence Lab involves pushing the boundaries of how machines understand and generate human speech, influencing both academic research and practical applications in AI-driven communication technologies. His expertise in programming languages like C++, Java, and Python has facilitated the development of robust and scalable speech processing systems."
  },
  {
    "researcher_name": "Richard Evans",
    "researcher_title": "Research Scientist at DeepMind",
    "researcher_company": "DeepMind",
    "linkedin_url": "https://www.linkedin.com/in/richard-evans-b3b43854",
    "google_scholar": null,
    "total_publications": 0,
    "analysis": "## Core Research Domain\nRichard Evans primarily focuses on developing advanced AI systems with a specialization in reinforcement learning and machine learning applications in robotics and machine vision.\n\n## Research Expertise\n- **Reinforcement Learning**: Expertise in designing and implementing reinforcement learning algorithms for complex decision-making tasks.\n- **Machine Vision**: Skilled in applying machine learning techniques to enhance computer vision systems, particularly in robotics.\n- **Large-Scale Data Processing**: Proficient in handling and processing large datasets to train and evaluate machine learning models effectively.\n- **Software Engineering**: Strong background in software development, enabling the translation of research into practical applications and products.\n\n## Key Contributions\n1. **Robotics and Machine Vision Applications**: Developed innovative machine vision systems that integrate with robotic platforms, enhancing their perception and interaction capabilities.\n2. **Reinforcement Learning Algorithms**: Contributed to the advancement of reinforcement learning techniques, improving their efficiency and applicability in real-world scenarios.\n\n## Research Cluster\nReinforcement Learning & Robotics\n\n## Impact Summary\nRichard Evans has significantly influenced the field of AI through his work at DeepMind, particularly in the areas of reinforcement learning and robotics. His contributions to machine vision and data processing have facilitated the development of more intelligent and autonomous systems. Evans's ability to bridge the gap between theoretical research and practical implementation has led to advancements in AI technologies, making him a notable figure in the AI research community. His work continues to impact the development of systems that require sophisticated decision-making and perception capabilities.",
    "analyzed_at": "2025-11-22T21:46:36.595383",
    "model_used": "gpt-4o",
    "core_domain": "Richard Evans primarily focuses on developing advanced AI systems with a specialization in reinforcement learning and machine learning applications in robotics and machine vision.",
    "expertise_areas": [
      "**Reinforcement Learning**: Expertise in designing and implementing reinforcement learning algorithms for complex decision-making tasks.",
      "**Machine Vision**: Skilled in applying machine learning techniques to enhance computer vision systems, particularly in robotics.",
      "**Large-Scale Data Processing**: Proficient in handling and processing large datasets to train and evaluate machine learning models effectively.",
      "**Software Engineering**: Strong background in software development, enabling the translation of research into practical applications and products."
    ],
    "key_contributions": [
      "1. **Robotics and Machine Vision Applications**: Developed innovative machine vision systems that integrate with robotic platforms, enhancing their perception and interaction capabilities.",
      "2. **Reinforcement Learning Algorithms**: Contributed to the advancement of reinforcement learning techniques, improving their efficiency and applicability in real-world scenarios."
    ],
    "research_cluster": "Reinforcement Learning & Robotics",
    "impact_summary": "Richard Evans has significantly influenced the field of AI through his work at DeepMind, particularly in the areas of reinforcement learning and robotics. His contributions to machine vision and data processing have facilitated the development of more intelligent and autonomous systems. Evans's ability to bridge the gap between theoretical research and practical implementation has led to advancements in AI technologies, making him a notable figure in the AI research community. His work continues to impact the development of systems that require sophisticated decision-making and perception capabilities."
  },
  {
    "researcher_name": "Martina Zambelli",
    "researcher_title": "Research Scientist at Google DeepMind, Co-founder of the Mediterranean Machine Learning (M2L) school",
    "researcher_company": "Google DeepMind",
    "linkedin_url": "https://www.linkedin.com/in/martina-zambelli-58013768",
    "google_scholar": "https://scholar.google.com/scholar?q=Martina+Zambelli",
    "total_publications": 5,
    "analysis": "## Core Research Domain\nMartina Zambelli primarily focuses on the intersection of robotics and multimodal AI, with an emphasis on developing cognitive architectures and sensorimotor representations that enable robots to interact intelligently with their environments.\n\n## Research Expertise\n- **Robotics and Control Systems**: Expertise in posture regulation and control mechanisms for unicycle-like robots, ensuring performance guarantees.\n- **Cognitive Architectures**: Development of proactive cognitive architectures for robots to acquire and express knowledge about the world and themselves.\n- **Multimodal Learning**: Specialization in integrating multiple sensory modalities to enhance robot imitation learning and decision-making.\n- **Sensorimotor Representations**: Focus on self-learned sensorimotor representations for improving robot perception and interaction.\n\n## Key Contributions\n1. **Posture Regulation for Unicycle-like Robots**: Developed methods for posture regulation with performance guarantees, contributing to the stability and control of robotic systems.\n2. **DAC-h3 Cognitive Architecture**: Co-developed a proactive cognitive architecture that allows robots to acquire and express knowledge, advancing the field of autonomous robotic cognition.\n3. **Multimodal Imitation Learning**: Pioneered techniques in using self-learned sensorimotor representations to enhance multimodal imitation learning, improving how robots learn from diverse sensory inputs.\n4. **Online Multimodal Ensemble Learning**: Innovated in online learning techniques that utilize self-learned sensorimotor representations, enabling more adaptive and robust robot learning systems.\n\n## Research Cluster\nMultimodal AI & Robotics\n\n## Impact Summary\nMartina Zambelli has significantly contributed to the advancement of robotic cognition and control through her work on cognitive architectures and multimodal learning. Her research has been pivotal in developing systems that allow robots to learn and interact with their environments more effectively. As a co-founder of the Mediterranean Machine Learning (M2L) school, she also plays a key role in fostering education and collaboration in AI research. Her work at Google DeepMind places her at the forefront of integrating AI with robotics, influencing both academic research and practical applications in autonomous systems.",
    "analyzed_at": "2025-11-22T21:46:42.428120",
    "model_used": "gpt-4o",
    "core_domain": "Martina Zambelli primarily focuses on the intersection of robotics and multimodal AI, with an emphasis on developing cognitive architectures and sensorimotor representations that enable robots to interact intelligently with their environments.",
    "expertise_areas": [
      "**Robotics and Control Systems**: Expertise in posture regulation and control mechanisms for unicycle-like robots, ensuring performance guarantees.",
      "**Cognitive Architectures**: Development of proactive cognitive architectures for robots to acquire and express knowledge about the world and themselves.",
      "**Multimodal Learning**: Specialization in integrating multiple sensory modalities to enhance robot imitation learning and decision-making.",
      "**Sensorimotor Representations**: Focus on self-learned sensorimotor representations for improving robot perception and interaction."
    ],
    "key_contributions": [
      "1. **Posture Regulation for Unicycle-like Robots**: Developed methods for posture regulation with performance guarantees, contributing to the stability and control of robotic systems.",
      "2. **DAC-h3 Cognitive Architecture**: Co-developed a proactive cognitive architecture that allows robots to acquire and express knowledge, advancing the field of autonomous robotic cognition.",
      "3. **Multimodal Imitation Learning**: Pioneered techniques in using self-learned sensorimotor representations to enhance multimodal imitation learning, improving how robots learn from diverse sensory inputs.",
      "4. **Online Multimodal Ensemble Learning**: Innovated in online learning techniques that utilize self-learned sensorimotor representations, enabling more adaptive and robust robot learning systems."
    ],
    "research_cluster": "Multimodal AI & Robotics",
    "impact_summary": "Martina Zambelli has significantly contributed to the advancement of robotic cognition and control through her work on cognitive architectures and multimodal learning. Her research has been pivotal in developing systems that allow robots to learn and interact with their environments more effectively. As a co-founder of the Mediterranean Machine Learning (M2L) school, she also plays a key role in fostering education and collaboration in AI research. Her work at Google DeepMind places her at the forefront of integrating AI with robotics, influencing both academic research and practical applications in autonomous systems."
  },
  {
    "researcher_name": "Ivan Vuli\u0107",
    "researcher_title": "Research Scientist at Google DeepMind",
    "researcher_company": "Google DeepMind",
    "linkedin_url": "https://www.linkedin.com/in/ivan-vuli\u0107-286b4a81",
    "google_scholar": "https://scholar.google.com/scholar?q=Ivan+Vuli\u0107",
    "total_publications": 1,
    "analysis": "## Core Research Domain\nIvan Vuli\u0107 primarily focuses on natural language processing (NLP) and machine learning (ML), with a strong emphasis on cross-lingual, multilingual, and conversational AI technologies.\n\n## Research Expertise\n- **Cross-lingual and Multilingual NLP**: Specializes in developing models and techniques that can process and understand multiple languages, facilitating cross-lingual transfer and multilingual applications.\n- **Conversational AI**: Expertise in creating advanced conversational systems and dialogue management frameworks, contributing to both academic research and industry applications.\n- **Machine Learning for NLP**: Utilizes machine learning methodologies to enhance NLP tasks, focusing on model training, optimization, and deployment in real-world scenarios.\n\n## Key Contributions\n1. **Conversational AI at PolyAI**: As a Senior Scientist and the first employee at PolyAI, Ivan Vuli\u0107 contributed significantly to the development of cutting-edge conversational AI technologies and solutions, bridging the gap between research and product-oriented NLP and ML applications.\n2. **Cross-lingual NLP Research**: Through his work at the University of Cambridge and Google DeepMind, he has advanced the understanding and implementation of cross-lingual and multilingual NLP models, influencing both academic research and practical applications in language technology.\n\n## Research Cluster\nMultilingual NLP & Conversational AI\n\n## Impact Summary\nIvan Vuli\u0107 has made significant contributions to the field of multilingual and conversational AI, impacting both academia and industry. His work at PolyAI and Google DeepMind has been instrumental in advancing conversational AI technologies, while his research at the University of Cambridge has pushed the boundaries of cross-lingual and multilingual NLP. Recognized for his expertise in these areas, he has played a crucial role in developing systems that enhance language understanding and interaction across diverse linguistic contexts.",
    "analyzed_at": "2025-11-22T21:46:47.017843",
    "model_used": "gpt-4o",
    "core_domain": "Ivan Vuli\u0107 primarily focuses on natural language processing (NLP) and machine learning (ML), with a strong emphasis on cross-lingual, multilingual, and conversational AI technologies.",
    "expertise_areas": [
      "**Cross-lingual and Multilingual NLP**: Specializes in developing models and techniques that can process and understand multiple languages, facilitating cross-lingual transfer and multilingual applications.",
      "**Conversational AI**: Expertise in creating advanced conversational systems and dialogue management frameworks, contributing to both academic research and industry applications.",
      "**Machine Learning for NLP**: Utilizes machine learning methodologies to enhance NLP tasks, focusing on model training, optimization, and deployment in real-world scenarios."
    ],
    "key_contributions": [
      "1. **Conversational AI at PolyAI**: As a Senior Scientist and the first employee at PolyAI, Ivan Vuli\u0107 contributed significantly to the development of cutting-edge conversational AI technologies and solutions, bridging the gap between research and product-oriented NLP and ML applications.",
      "2. **Cross-lingual NLP Research**: Through his work at the University of Cambridge and Google DeepMind, he has advanced the understanding and implementation of cross-lingual and multilingual NLP models, influencing both academic research and practical applications in language technology."
    ],
    "research_cluster": "Multilingual NLP & Conversational AI",
    "impact_summary": "Ivan Vuli\u0107 has made significant contributions to the field of multilingual and conversational AI, impacting both academia and industry. His work at PolyAI and Google DeepMind has been instrumental in advancing conversational AI technologies, while his research at the University of Cambridge has pushed the boundaries of cross-lingual and multilingual NLP. Recognized for his expertise in these areas, he has played a crucial role in developing systems that enhance language understanding and interaction across diverse linguistic contexts."
  },
  {
    "researcher_name": "L\u00e9onard Berrada",
    "researcher_title": "Staff Research Scientist at Google DeepMind",
    "researcher_company": "Google DeepMind",
    "linkedin_url": "https://www.linkedin.com/in/leonardberrada",
    "google_scholar": "https://scholar.google.com/scholar?q=L\u00e9onard+Berrada",
    "total_publications": 4,
    "analysis": "## Core Research Domain\nL\u00e9onard Berrada's primary research focus is on neural network optimization and training methodologies, with a specialization in developing efficient algorithms and loss functions to enhance the performance and reliability of large-scale neural networks.\n\n## Research Expertise\n- **Neural Network Optimization**: Specializes in optimization techniques for training deep neural networks, including the development of novel algorithms like Deep Frank-Wolfe.\n- **Loss Function Design**: Expertise in designing smooth loss functions tailored for specific classification tasks, such as deep top-k classification.\n- **Machine Learning Theory**: Strong foundation in theoretical aspects of machine learning, particularly in interpolation and trust-region methods for neural networks.\n\n## Key Contributions\n1. **Training Neural Networks for and by Interpolation**: Developed methods to improve neural network training by leveraging interpolation techniques, enhancing both efficiency and accuracy.\n2. **Deep Frank-Wolfe For Neural Network Optimization**: Introduced the Deep Frank-Wolfe algorithm, a novel optimization approach that improves convergence rates and scalability in training deep networks.\n3. **Smooth Loss Functions for Deep Top-k Classification**: Created smooth loss functions that facilitate better performance in top-k classification tasks, addressing challenges in ranking and selection within neural networks.\n4. **Trusting SVM for Piecewise Linear CNNs**: Proposed a framework that integrates SVM trust-region methods with piecewise linear CNNs, improving reliability and interpretability.\n\n## Research Cluster\nLLM Training & Optimization\n\n## Impact Summary\nL\u00e9onard Berrada has significantly influenced the field of neural network optimization through his development of innovative algorithms and loss functions that enhance the training and performance of large-scale models. His work on the Deep Frank-Wolfe algorithm and smooth loss functions has been particularly impactful, providing new tools and methodologies that have been adopted in both academic and industrial settings. As a Staff Research Scientist at Google DeepMind, Berrada plays a crucial role in advancing the capabilities of large-scale pre-training projects like Gemini, contributing to the frontier of AI research and development.",
    "analyzed_at": "2025-11-22T21:46:51.456140",
    "model_used": "gpt-4o",
    "core_domain": "L\u00e9onard Berrada's primary research focus is on neural network optimization and training methodologies, with a specialization in developing efficient algorithms and loss functions to enhance the performance and reliability of large-scale neural networks.",
    "expertise_areas": [
      "**Neural Network Optimization**: Specializes in optimization techniques for training deep neural networks, including the development of novel algorithms like Deep Frank-Wolfe.",
      "**Loss Function Design**: Expertise in designing smooth loss functions tailored for specific classification tasks, such as deep top-k classification.",
      "**Machine Learning Theory**: Strong foundation in theoretical aspects of machine learning, particularly in interpolation and trust-region methods for neural networks."
    ],
    "key_contributions": [
      "1. **Training Neural Networks for and by Interpolation**: Developed methods to improve neural network training by leveraging interpolation techniques, enhancing both efficiency and accuracy.",
      "2. **Deep Frank-Wolfe For Neural Network Optimization**: Introduced the Deep Frank-Wolfe algorithm, a novel optimization approach that improves convergence rates and scalability in training deep networks.",
      "3. **Smooth Loss Functions for Deep Top-k Classification**: Created smooth loss functions that facilitate better performance in top-k classification tasks, addressing challenges in ranking and selection within neural networks.",
      "4. **Trusting SVM for Piecewise Linear CNNs**: Proposed a framework that integrates SVM trust-region methods with piecewise linear CNNs, improving reliability and interpretability."
    ],
    "research_cluster": "LLM Training & Optimization",
    "impact_summary": "L\u00e9onard Berrada has significantly influenced the field of neural network optimization through his development of innovative algorithms and loss functions that enhance the training and performance of large-scale models. His work on the Deep Frank-Wolfe algorithm and smooth loss functions has been particularly impactful, providing new tools and methodologies that have been adopted in both academic and industrial settings. As a Staff Research Scientist at Google DeepMind, Berrada plays a crucial role in advancing the capabilities of large-scale pre-training projects like Gemini, contributing to the frontier of AI research and development."
  },
  {
    "researcher_name": "Ryan Burnell",
    "researcher_title": "Staff Research Scientist at Google DeepMind",
    "researcher_company": "Google DeepMind",
    "linkedin_url": "https://www.linkedin.com/in/ryan-burnell-4a008ba4",
    "google_scholar": "https://scholar.google.com/scholar?q=Ryan+Burnell",
    "total_publications": 6,
    "analysis": "## Core Research Domain\nRyan Burnell's primary research focus is on integrating cognitive science principles to enhance the development of AI systems that are more capable, safe, and robust. His work aims to understand and leverage human cognitive processes to improve AI evaluation and functionality.\n\n## Research Expertise\n- **Cognitive Science Integration**: Applying cognitive science insights to AI development to enhance system capabilities and safety.\n- **AI Evaluation and Benchmarking**: Developing methodologies to assess AI capabilities and performance, focusing on instance features and their implications.\n- **Human-AI Interaction**: Studying the impact of AI on human decision-making and the reciprocal influence of human experiences on AI perception.\n- **Memory and Decision-Making**: Investigating how human memory, both positive and negative, affects decision-making processes and AI system design.\n\n## Key Contributions\n1. **Memories and AI Interaction**: Explored how memories, even those no longer believed in, can influence human behavior in both beneficial and detrimental ways, providing insights into AI systems that interact with human memory and decision-making.\n2. **Capability-Oriented AI Evaluation**: Developed frameworks for identifying instance features critical for evaluating AI capabilities, contributing to more nuanced and effective AI benchmarking.\n3. **Social and Behavioral Impacts of AI**: Analyzed the societal implications of AI systems, such as the potential backlash of \"Vaccine Passports,\" highlighting the importance of considering social contexts in AI deployment.\n\n## Research Cluster\nCognitive Science & AI Evaluation\n\n## Impact Summary\nRyan Burnell has significantly contributed to the understanding of how cognitive science can inform AI development, particularly in creating systems that are both effective and socially aware. His work on AI evaluation frameworks has provided valuable tools for assessing AI capabilities, influencing both academic research and practical applications. By examining the interplay between human experiences and AI, Burnell has highlighted the importance of considering psychological and social factors in AI system design, thereby advancing the field towards more holistic and human-centered AI solutions.",
    "analyzed_at": "2025-11-22T21:46:57.860184",
    "model_used": "gpt-4o",
    "core_domain": "Ryan Burnell's primary research focus is on integrating cognitive science principles to enhance the development of AI systems that are more capable, safe, and robust. His work aims to understand and leverage human cognitive processes to improve AI evaluation and functionality.",
    "expertise_areas": [
      "**Cognitive Science Integration**: Applying cognitive science insights to AI development to enhance system capabilities and safety.",
      "**AI Evaluation and Benchmarking**: Developing methodologies to assess AI capabilities and performance, focusing on instance features and their implications.",
      "**Human-AI Interaction**: Studying the impact of AI on human decision-making and the reciprocal influence of human experiences on AI perception.",
      "**Memory and Decision-Making**: Investigating how human memory, both positive and negative, affects decision-making processes and AI system design."
    ],
    "key_contributions": [
      "1. **Memories and AI Interaction**: Explored how memories, even those no longer believed in, can influence human behavior in both beneficial and detrimental ways, providing insights into AI systems that interact with human memory and decision-making.",
      "2. **Capability-Oriented AI Evaluation**: Developed frameworks for identifying instance features critical for evaluating AI capabilities, contributing to more nuanced and effective AI benchmarking.",
      "3. **Social and Behavioral Impacts of AI**: Analyzed the societal implications of AI systems, such as the potential backlash of \"Vaccine Passports,\" highlighting the importance of considering social contexts in AI deployment."
    ],
    "research_cluster": "Cognitive Science & AI Evaluation",
    "impact_summary": "Ryan Burnell has significantly contributed to the understanding of how cognitive science can inform AI development, particularly in creating systems that are both effective and socially aware. His work on AI evaluation frameworks has provided valuable tools for assessing AI capabilities, influencing both academic research and practical applications. By examining the interplay between human experiences and AI, Burnell has highlighted the importance of considering psychological and social factors in AI system design, thereby advancing the field towards more holistic and human-centered AI solutions."
  },
  {
    "researcher_name": "Kyle Kastner",
    "researcher_title": "speech research for all",
    "researcher_company": "Google DeepMind",
    "linkedin_url": "https://www.linkedin.com/in/kyle-kastner-4a160524",
    "google_scholar": "https://scholar.google.com/scholar?q=Kyle+Kastner",
    "total_publications": 1,
    "analysis": "## Core Research Domain\nKyle Kastner's primary research focus is on the intersection of speech processing and machine learning, with a particular emphasis on integrating computational techniques with music and audio analysis.\n\n## Research Expertise\n- **Speech Processing**: Specializes in developing algorithms and models for speech recognition and synthesis.\n- **Machine Learning for Audio**: Expertise in applying machine learning techniques to analyze and generate audio and music.\n- **Multimodal AI**: Combines audio, speech, and other modalities to create comprehensive AI systems.\n\n## Key Contributions\n1. **Speech Research at Google DeepMind**: Contributed to advancing speech technologies by integrating cutting-edge machine learning techniques into speech processing systems.\n2. **Computers and Music**: Explored the synergy between computational methods and music, contributing to projects that blend AI with musical creativity and analysis.\n\n## Research Cluster\nMultimodal AI & Vision\n\n## Impact Summary\nKyle Kastner has significantly influenced the field of speech processing and multimodal AI through his work at Google DeepMind, where he focuses on integrating advanced machine learning techniques with audio and music analysis. His contributions have helped enhance the capabilities of AI systems in understanding and generating speech, and his interdisciplinary approach has fostered innovation at the intersection of technology and the arts. His work is recognized for pushing the boundaries of how AI can interact with and interpret complex audio signals.",
    "analyzed_at": "2025-11-22T21:47:01.941657",
    "model_used": "gpt-4o",
    "core_domain": "Kyle Kastner's primary research focus is on the intersection of speech processing and machine learning, with a particular emphasis on integrating computational techniques with music and audio analysis.",
    "expertise_areas": [
      "**Speech Processing**: Specializes in developing algorithms and models for speech recognition and synthesis.",
      "**Machine Learning for Audio**: Expertise in applying machine learning techniques to analyze and generate audio and music.",
      "**Multimodal AI**: Combines audio, speech, and other modalities to create comprehensive AI systems."
    ],
    "key_contributions": [
      "1. **Speech Research at Google DeepMind**: Contributed to advancing speech technologies by integrating cutting-edge machine learning techniques into speech processing systems.",
      "2. **Computers and Music**: Explored the synergy between computational methods and music, contributing to projects that blend AI with musical creativity and analysis."
    ],
    "research_cluster": "Multimodal AI & Vision",
    "impact_summary": "Kyle Kastner has significantly influenced the field of speech processing and multimodal AI through his work at Google DeepMind, where he focuses on integrating advanced machine learning techniques with audio and music analysis. His contributions have helped enhance the capabilities of AI systems in understanding and generating speech, and his interdisciplinary approach has fostered innovation at the intersection of technology and the arts. His work is recognized for pushing the boundaries of how AI can interact with and interpret complex audio signals."
  },
  {
    "researcher_name": "Songyou Peng",
    "researcher_title": "Research Scientist at Google DeepMind",
    "researcher_company": "Google DeepMind",
    "linkedin_url": "https://www.linkedin.com/in/songyou-peng-53717648",
    "google_scholar": "https://scholar.google.com/scholar?q=Songyou+Peng",
    "total_publications": 5,
    "analysis": "## Core Research Domain\nSongyou Peng primarily focuses on computer vision and 3D reconstruction, with a specialization in developing novel methodologies for depth estimation, implicit representations, and photometric techniques.\n\n## Research Expertise\n- **Implicit 3D Representations**: Expertise in using implicit functions for 3D shape modeling and reconstruction, particularly through Convolutional Occupancy Networks.\n- **Photometric Techniques**: Skilled in leveraging photometric methods for depth estimation and super-resolution, as evidenced by work on photometric depth super-resolution.\n- **Camera Calibration**: Proficient in developing systems for accurate camera calibration, addressing geometric and corner uncertainty.\n\n## Key Contributions\n1. **Convolutional Occupancy Networks**: Developed a framework for 3D shape reconstruction using implicit representations, enabling more accurate and flexible modeling of complex geometries.\n2. **DIST (Differentiable Sphere Tracing)**: Advanced the rendering of deep implicit signed distance functions, improving the efficiency and accuracy of rendering 3D shapes.\n3. **Calibration Wizard**: Created a guidance system for camera calibration that models geometric and corner uncertainty, enhancing the precision of camera setups.\n4. **Photometric Depth Super-Resolution**: Innovated techniques for enhancing depth resolution using photometric stereo, merging depth super-resolution with uncalibrated photometric stereo methods.\n\n## Research Cluster\nMultimodal AI & Vision\n\n## Impact Summary\nSongyou Peng has significantly contributed to the field of computer vision, particularly in the areas of 3D reconstruction and depth estimation. His work on implicit representations and photometric techniques has influenced both academic research and practical applications in 3D modeling and camera systems. As a Research Scientist at Google DeepMind, Peng continues to push the boundaries of how AI can interpret and reconstruct the visual world, contributing to advancements in both theoretical frameworks and practical implementations.",
    "analyzed_at": "2025-11-22T21:47:05.613196",
    "model_used": "gpt-4o",
    "core_domain": "Songyou Peng primarily focuses on computer vision and 3D reconstruction, with a specialization in developing novel methodologies for depth estimation, implicit representations, and photometric techniques.",
    "expertise_areas": [
      "**Implicit 3D Representations**: Expertise in using implicit functions for 3D shape modeling and reconstruction, particularly through Convolutional Occupancy Networks.",
      "**Photometric Techniques**: Skilled in leveraging photometric methods for depth estimation and super-resolution, as evidenced by work on photometric depth super-resolution.",
      "**Camera Calibration**: Proficient in developing systems for accurate camera calibration, addressing geometric and corner uncertainty."
    ],
    "key_contributions": [
      "1. **Convolutional Occupancy Networks**: Developed a framework for 3D shape reconstruction using implicit representations, enabling more accurate and flexible modeling of complex geometries.",
      "2. **DIST (Differentiable Sphere Tracing)**: Advanced the rendering of deep implicit signed distance functions, improving the efficiency and accuracy of rendering 3D shapes.",
      "3. **Calibration Wizard**: Created a guidance system for camera calibration that models geometric and corner uncertainty, enhancing the precision of camera setups.",
      "4. **Photometric Depth Super-Resolution**: Innovated techniques for enhancing depth resolution using photometric stereo, merging depth super-resolution with uncalibrated photometric stereo methods."
    ],
    "research_cluster": "Multimodal AI & Vision",
    "impact_summary": "Songyou Peng has significantly contributed to the field of computer vision, particularly in the areas of 3D reconstruction and depth estimation. His work on implicit representations and photometric techniques has influenced both academic research and practical applications in 3D modeling and camera systems. As a Research Scientist at Google DeepMind, Peng continues to push the boundaries of how AI can interpret and reconstruct the visual world, contributing to advancements in both theoretical frameworks and practical implementations."
  },
  {
    "researcher_name": "Junkyung Kim",
    "researcher_title": "Senior Research Scientist at DeepMind",
    "researcher_company": "Google DeepMind",
    "linkedin_url": "https://www.linkedin.com/in/junkyung-kim-b99585a4",
    "google_scholar": "https://scholar.google.com/scholar?q=Junkyung+Kim",
    "total_publications": 7,
    "analysis": "## Core Research Domain\nJunkyung Kim's primary research focus is on developing advanced AI systems that integrate visual intelligence and cognitive science principles to enhance robotics and embodied reasoning agents. His work aims to bridge the gap between perception and reasoning in AI through innovative neural network architectures and methodologies.\n\n## Research Expertise\n- **Visual Intelligence and Perception**: Specializes in understanding and replicating human-like visual processing in AI systems, particularly through perceptual grouping and image segmentation techniques.\n- **Neural Network Architectures**: Expertise in designing and implementing recurrent neural networks and gated-recurrent units to model complex spatial and temporal dependencies.\n- **Cognitive Science and Embodied AI**: Applies principles from cognitive science to develop embodied reasoning agents that can interact with and learn from their environments.\n\n## Key Contributions\n1. **Disentangling Neural Mechanisms for Perceptual Grouping**: This work explores how neural networks can be structured to mimic human perceptual grouping, a fundamental aspect of visual processing, enhancing AI's ability to interpret complex visual scenes.\n2. **Sample-efficient Image Segmentation through Recurrence**: Developed methods to improve image segmentation using recurrent neural networks, achieving greater efficiency and accuracy with fewer samples.\n3. **Robust Neural Circuit Reconstruction**: Advanced techniques for reconstructing neural circuits from electron microscopy data using convolutional recurrent networks, contributing to the field of neuroscience and AI.\n4. **Learning Long-range Spatial Dependencies**: Innovated the use of horizontal gated-recurrent units to capture long-range dependencies in spatial data, improving the performance of AI models in tasks requiring spatial reasoning.\n\n## Research Cluster\nMultimodal AI & Vision\n\n## Impact Summary\nJunkyung Kim has significantly influenced the field of AI by integrating cognitive science principles with advanced neural network architectures to enhance visual intelligence and reasoning in AI systems. His contributions to perceptual grouping and image segmentation have improved the efficiency and accuracy of visual processing in AI, making strides in the development of embodied reasoning agents. As a senior research scientist at DeepMind, his work continues to push the boundaries of how AI can perceive and interact with the world, positioning him as a key figure in the advancement of multimodal AI and robotics.",
    "analyzed_at": "2025-11-22T21:47:11.403398",
    "model_used": "gpt-4o",
    "core_domain": "Junkyung Kim's primary research focus is on developing advanced AI systems that integrate visual intelligence and cognitive science principles to enhance robotics and embodied reasoning agents. His work aims to bridge the gap between perception and reasoning in AI through innovative neural network architectures and methodologies.",
    "expertise_areas": [
      "**Visual Intelligence and Perception**: Specializes in understanding and replicating human-like visual processing in AI systems, particularly through perceptual grouping and image segmentation techniques.",
      "**Neural Network Architectures**: Expertise in designing and implementing recurrent neural networks and gated-recurrent units to model complex spatial and temporal dependencies.",
      "**Cognitive Science and Embodied AI**: Applies principles from cognitive science to develop embodied reasoning agents that can interact with and learn from their environments."
    ],
    "key_contributions": [
      "1. **Disentangling Neural Mechanisms for Perceptual Grouping**: This work explores how neural networks can be structured to mimic human perceptual grouping, a fundamental aspect of visual processing, enhancing AI's ability to interpret complex visual scenes.",
      "2. **Sample-efficient Image Segmentation through Recurrence**: Developed methods to improve image segmentation using recurrent neural networks, achieving greater efficiency and accuracy with fewer samples.",
      "3. **Robust Neural Circuit Reconstruction**: Advanced techniques for reconstructing neural circuits from electron microscopy data using convolutional recurrent networks, contributing to the field of neuroscience and AI.",
      "4. **Learning Long-range Spatial Dependencies**: Innovated the use of horizontal gated-recurrent units to capture long-range dependencies in spatial data, improving the performance of AI models in tasks requiring spatial reasoning."
    ],
    "research_cluster": "Multimodal AI & Vision",
    "impact_summary": "Junkyung Kim has significantly influenced the field of AI by integrating cognitive science principles with advanced neural network architectures to enhance visual intelligence and reasoning in AI systems. His contributions to perceptual grouping and image segmentation have improved the efficiency and accuracy of visual processing in AI, making strides in the development of embodied reasoning agents. As a senior research scientist at DeepMind, his work continues to push the boundaries of how AI can perceive and interact with the world, positioning him as a key figure in the advancement of multimodal AI and robotics."
  },
  {
    "researcher_name": "Azade Nova",
    "researcher_title": "Senior Research Scientist at Google DeepMind",
    "researcher_company": "DeepMind",
    "linkedin_url": "https://www.linkedin.com/in/azade-nova-bb347763",
    "google_scholar": "https://scholar.google.com/scholar?q=Azade+Nova",
    "total_publications": 8,
    "analysis": "## Core Research Domain\nAzade Nova's primary research focus lies in the intersection of social network analysis and information retrieval systems, with a specialization in developing methodologies for querying and extracting insights from online community networks.\n\n## Research Expertise\n- **Social Network Analysis**: Expertise in analyzing and modeling online social networks to understand user behavior and interaction patterns.\n- **Information Retrieval Systems**: Development of systems and algorithms for efficient querying and data extraction from web-based platforms.\n- **Community Network Dynamics**: Studying the dynamics of online communities to enhance user engagement and participation.\n\n## Key Contributions\n1. **AD-WIRE: Add-on for Web Item Reviewing System**: Developed a system to enhance the review process of web items, likely focusing on improving user interaction and feedback mechanisms.\n2. **Answering Complex Queries in an Online Community Network**: Proposed methodologies for handling and resolving complex queries within online community networks, enhancing the accuracy and relevance of information retrieval.\n3. **The TagAdvisor: Luring the Lurkers to Review Web Items**: Created a system aimed at increasing participation from passive users in online communities, thereby enriching the data pool and improving community engagement.\n\n## Research Cluster\n\"Social Network Analysis & Information Retrieval\"\n\n## Impact Summary\nAzade Nova has significantly contributed to the field of social network analysis by developing innovative systems that improve data extraction and user engagement in online communities. Her work on enhancing the interaction dynamics within these networks has influenced how information retrieval systems are designed, particularly in terms of user participation and data accuracy. As a Senior Research Scientist at Google DeepMind, her research continues to push the boundaries of how complex queries and hidden attributes are managed in large-scale online networks, impacting both academic research and practical applications in the industry.",
    "analyzed_at": "2025-11-22T21:47:15.917616",
    "model_used": "gpt-4o",
    "core_domain": "Azade Nova's primary research focus lies in the intersection of social network analysis and information retrieval systems, with a specialization in developing methodologies for querying and extracting insights from online community networks.",
    "expertise_areas": [
      "**Social Network Analysis**: Expertise in analyzing and modeling online social networks to understand user behavior and interaction patterns.",
      "**Information Retrieval Systems**: Development of systems and algorithms for efficient querying and data extraction from web-based platforms.",
      "**Community Network Dynamics**: Studying the dynamics of online communities to enhance user engagement and participation."
    ],
    "key_contributions": [
      "1. **AD-WIRE: Add-on for Web Item Reviewing System**: Developed a system to enhance the review process of web items, likely focusing on improving user interaction and feedback mechanisms.",
      "2. **Answering Complex Queries in an Online Community Network**: Proposed methodologies for handling and resolving complex queries within online community networks, enhancing the accuracy and relevance of information retrieval.",
      "3. **The TagAdvisor: Luring the Lurkers to Review Web Items**: Created a system aimed at increasing participation from passive users in online communities, thereby enriching the data pool and improving community engagement."
    ],
    "research_cluster": "\"Social Network Analysis & Information Retrieval\"",
    "impact_summary": "Azade Nova has significantly contributed to the field of social network analysis by developing innovative systems that improve data extraction and user engagement in online communities. Her work on enhancing the interaction dynamics within these networks has influenced how information retrieval systems are designed, particularly in terms of user participation and data accuracy. As a Senior Research Scientist at Google DeepMind, her research continues to push the boundaries of how complex queries and hidden attributes are managed in large-scale online networks, impacting both academic research and practical applications in the industry."
  },
  {
    "researcher_name": "Nitish Gupta",
    "researcher_title": "Senior Research Scientist at Google DeepMind",
    "researcher_company": "Google DeepMind",
    "linkedin_url": "https://www.linkedin.com/in/nitish-gupta-8bbb71130",
    "google_scholar": null,
    "total_publications": 0,
    "analysis": "## Core Research Domain\nNitish Gupta's primary research focus is on Natural Language Processing (NLP) and Machine Learning, with a particular emphasis on developing models and techniques that enhance language understanding and generation.\n\n## Research Expertise\n- **Natural Language Processing (NLP)**: Expertise in developing algorithms for language understanding and generation.\n- **Machine Learning**: Proficient in applying machine learning techniques to solve complex problems in NLP.\n- **Large Language Models (LLMs)**: Specializes in training and fine-tuning large-scale language models for improved performance in various NLP tasks.\n\n## Key Contributions\n1. **Advanced NLP Models**: Contributed to the development of state-of-the-art NLP models that improve language understanding and generation capabilities.\n2. **Innovative Machine Learning Techniques**: Developed novel machine learning methodologies that enhance the efficiency and effectiveness of NLP systems.\n\n## Research Cluster\nLLM Training & Alignment\n\n## Impact Summary\nNitish Gupta has significantly influenced the field of NLP through his work on large language models, contributing to advancements in language understanding and generation. His research at Google DeepMind has led to the development of cutting-edge NLP systems that push the boundaries of what is possible with machine learning and artificial intelligence. His contributions have been recognized for their impact on both academic research and practical applications in AI.",
    "analyzed_at": "2025-11-22T21:47:19.642335",
    "model_used": "gpt-4o",
    "core_domain": "Nitish Gupta's primary research focus is on Natural Language Processing (NLP) and Machine Learning, with a particular emphasis on developing models and techniques that enhance language understanding and generation.",
    "expertise_areas": [
      "**Natural Language Processing (NLP)**: Expertise in developing algorithms for language understanding and generation.",
      "**Machine Learning**: Proficient in applying machine learning techniques to solve complex problems in NLP.",
      "**Large Language Models (LLMs)**: Specializes in training and fine-tuning large-scale language models for improved performance in various NLP tasks."
    ],
    "key_contributions": [
      "1. **Advanced NLP Models**: Contributed to the development of state-of-the-art NLP models that improve language understanding and generation capabilities.",
      "2. **Innovative Machine Learning Techniques**: Developed novel machine learning methodologies that enhance the efficiency and effectiveness of NLP systems."
    ],
    "research_cluster": "LLM Training & Alignment",
    "impact_summary": "Nitish Gupta has significantly influenced the field of NLP through his work on large language models, contributing to advancements in language understanding and generation. His research at Google DeepMind has led to the development of cutting-edge NLP systems that push the boundaries of what is possible with machine learning and artificial intelligence. His contributions have been recognized for their impact on both academic research and practical applications in AI."
  },
  {
    "researcher_name": "Mislav Balunovi\u0107",
    "researcher_title": "Senior Research Scientist at Google DeepMind",
    "researcher_company": "Google DeepMind",
    "linkedin_url": "https://www.linkedin.com/in/mislav-balunovi\u0107-918911a2",
    "google_scholar": null,
    "total_publications": 0,
    "analysis": "## Core Research Domain\nMislav Balunovi\u0107's primary research focus is on enhancing the mathematical reasoning and theorem proving capabilities of large language models (LLMs). His work is particularly centered on developing benchmarks and methodologies to evaluate and improve the performance of AI systems in solving complex mathematical problems.\n\n## Research Expertise\n- **Mathematical Reasoning in AI**: Specializes in improving the ability of AI models to understand and solve mathematical problems.\n- **Theorem Proving**: Focuses on advancing the capabilities of LLMs in automated theorem proving.\n- **Benchmark Development**: Expertise in creating comprehensive benchmarks for evaluating AI performance in mathematical contexts.\n- **AI for Mathematics**: Applies AI techniques to enhance problem-solving in mathematical domains.\n\n## Key Contributions\n1. **MathArena**: Developed MathArena (matharena.ai), a benchmark designed to evaluate LLMs on recent math competitions. This tool is now utilized by leading AI labs such as Google DeepMind, xAI, and Microsoft to assess and improve their models' mathematical reasoning abilities.\n2. **Theorem Proving Enhancements**: Contributed to the advancement of LLMs' theorem proving capabilities, facilitating more accurate and efficient problem-solving in mathematical contexts.\n\n## Research Cluster\nLLM Training & Alignment\n\n## Impact Summary\nMislav Balunovi\u0107 has significantly influenced the field of AI for mathematics by developing MathArena, a critical benchmark for evaluating LLMs on complex mathematical tasks. His work has been recognized and adopted by major AI research labs, demonstrating his contributions to advancing the state-of-the-art in AI-driven mathematical reasoning. His achievements in international mathematics and informatics competitions further underscore his deep expertise and impact in the domain.",
    "analyzed_at": "2025-11-22T21:47:24.336980",
    "model_used": "gpt-4o",
    "core_domain": "Mislav Balunovi\u0107's primary research focus is on enhancing the mathematical reasoning and theorem proving capabilities of large language models (LLMs). His work is particularly centered on developing benchmarks and methodologies to evaluate and improve the performance of AI systems in solving complex mathematical problems.",
    "expertise_areas": [
      "**Mathematical Reasoning in AI**: Specializes in improving the ability of AI models to understand and solve mathematical problems.",
      "**Theorem Proving**: Focuses on advancing the capabilities of LLMs in automated theorem proving.",
      "**Benchmark Development**: Expertise in creating comprehensive benchmarks for evaluating AI performance in mathematical contexts.",
      "**AI for Mathematics**: Applies AI techniques to enhance problem-solving in mathematical domains."
    ],
    "key_contributions": [
      "1. **MathArena**: Developed MathArena (matharena.ai), a benchmark designed to evaluate LLMs on recent math competitions. This tool is now utilized by leading AI labs such as Google DeepMind, xAI, and Microsoft to assess and improve their models' mathematical reasoning abilities.",
      "2. **Theorem Proving Enhancements**: Contributed to the advancement of LLMs' theorem proving capabilities, facilitating more accurate and efficient problem-solving in mathematical contexts."
    ],
    "research_cluster": "LLM Training & Alignment",
    "impact_summary": "Mislav Balunovi\u0107 has significantly influenced the field of AI for mathematics by developing MathArena, a critical benchmark for evaluating LLMs on complex mathematical tasks. His work has been recognized and adopted by major AI research labs, demonstrating his contributions to advancing the state-of-the-art in AI-driven mathematical reasoning. His achievements in international mathematics and informatics competitions further underscore his deep expertise and impact in the domain."
  },
  {
    "researcher_name": "Yuma Koizumi",
    "researcher_title": "Google DeepMind - Staff Research Scientist",
    "researcher_company": "Google DeepMind",
    "linkedin_url": "https://www.linkedin.com/in/yuma-koizumi-078661176",
    "google_scholar": "https://scholar.google.com/scholar?q=Yuma+Koizumi",
    "total_publications": 3,
    "analysis": "## Core Research Domain\nYuma Koizumi's primary research focus is on acoustic and speech signal processing, with a specialization in deep learning applications for speech enhancement and sound anomaly detection.\n\n## Research Expertise\n- **Speech Enhancement**: Developing deep learning models to improve the quality and intelligibility of speech signals.\n- **Sound Anomaly Detection**: Utilizing unsupervised and deep learning techniques to identify anomalous sounds in various environments.\n- **Acoustic Feature Selection**: Applying methods to optimize feature selection for better sound source identification and analysis.\n\n## Key Contributions\n1. **Unsupervised Detection of Anomalous Sound**: Developed a method based on deep learning and the Neyman-Pearson Lemma to effectively detect anomalous sounds without labeled data, enhancing the robustness of sound monitoring systems.\n2. **DNN-based Source Enhancement**: Created a deep neural network approach to enhance sound sources, significantly improving objective sound quality assessment scores, which is crucial for applications in noisy environments.\n\n## Research Cluster\nAcoustic Signal Processing & Deep Learning\n\n## Impact Summary\nYuma Koizumi has significantly influenced the field of acoustic signal processing through his innovative use of deep learning techniques. His work on unsupervised sound anomaly detection and speech enhancement has been recognized in top-tier journals and conferences, contributing to advancements in how machines perceive and process auditory information. His research not only advances theoretical understanding but also has practical implications for improving audio quality in consumer electronics and industrial applications.",
    "analyzed_at": "2025-11-22T21:47:29.025401",
    "model_used": "gpt-4o",
    "core_domain": "Yuma Koizumi's primary research focus is on acoustic and speech signal processing, with a specialization in deep learning applications for speech enhancement and sound anomaly detection.",
    "expertise_areas": [
      "**Speech Enhancement**: Developing deep learning models to improve the quality and intelligibility of speech signals.",
      "**Sound Anomaly Detection**: Utilizing unsupervised and deep learning techniques to identify anomalous sounds in various environments.",
      "**Acoustic Feature Selection**: Applying methods to optimize feature selection for better sound source identification and analysis."
    ],
    "key_contributions": [
      "1. **Unsupervised Detection of Anomalous Sound**: Developed a method based on deep learning and the Neyman-Pearson Lemma to effectively detect anomalous sounds without labeled data, enhancing the robustness of sound monitoring systems.",
      "2. **DNN-based Source Enhancement**: Created a deep neural network approach to enhance sound sources, significantly improving objective sound quality assessment scores, which is crucial for applications in noisy environments."
    ],
    "research_cluster": "Acoustic Signal Processing & Deep Learning",
    "impact_summary": "Yuma Koizumi has significantly influenced the field of acoustic signal processing through his innovative use of deep learning techniques. His work on unsupervised sound anomaly detection and speech enhancement has been recognized in top-tier journals and conferences, contributing to advancements in how machines perceive and process auditory information. His research not only advances theoretical understanding but also has practical implications for improving audio quality in consumer electronics and industrial applications."
  },
  {
    "researcher_name": "Raia Hadsell",
    "researcher_title": "VP of Research at Google DeepMind",
    "researcher_company": "Google DeepMind",
    "linkedin_url": "https://www.linkedin.com/in/raia-hadsell-35400266",
    "google_scholar": null,
    "total_publications": 0,
    "analysis": "## Core Research Domain\nRaia Hadsell's primary research focus is on the intersection of deep learning and reinforcement learning, particularly in the context of robotics. She leverages principles from neuroscience to develop algorithms that enable robots to learn and adapt autonomously.\n\n## Research Expertise\n- **Reinforcement Learning**: Specializes in developing algorithms that allow agents to learn from interactions with their environment.\n- **Robotics**: Focuses on applying AI techniques to enable robots to perform complex tasks autonomously.\n- **Neuroscience-Inspired AI**: Utilizes insights from neuroscience to inform the design of learning algorithms.\n- **Continual Learning**: Works on methods that allow AI systems to learn continuously without forgetting previous knowledge.\n\n## Key Contributions\n1. **Deep Reinforcement Learning for Robotics**: Developed algorithms that improve the ability of robots to learn tasks through trial and error, significantly advancing the field of robotic autonomy.\n2. **Neuroscience-Inspired Learning Algorithms**: Pioneered approaches that incorporate principles from neuroscience to enhance the learning capabilities of AI systems, such as using neural plasticity concepts.\n3. **Continual Learning Frameworks**: Contributed to the development of frameworks that enable AI systems to retain and integrate new knowledge over time without catastrophic forgetting.\n\n## Research Cluster\nReinforcement Learning & Robotics\n\n## Impact Summary\nRaia Hadsell has significantly influenced the field of AI by integrating neuroscience principles into reinforcement learning and robotics. Her work on continual learning has addressed critical challenges in AI, such as the ability to learn incrementally without forgetting. As VP of Research at Google DeepMind, she plays a pivotal role in advancing frontier AI research, contributing to both theoretical advancements and practical applications in robotics. Her contributions have been recognized for pushing the boundaries of what AI systems can achieve in dynamic and complex environments.",
    "analyzed_at": "2025-11-22T21:47:33.428079",
    "model_used": "gpt-4o",
    "core_domain": "Raia Hadsell's primary research focus is on the intersection of deep learning and reinforcement learning, particularly in the context of robotics. She leverages principles from neuroscience to develop algorithms that enable robots to learn and adapt autonomously.",
    "expertise_areas": [
      "**Reinforcement Learning**: Specializes in developing algorithms that allow agents to learn from interactions with their environment.",
      "**Robotics**: Focuses on applying AI techniques to enable robots to perform complex tasks autonomously.",
      "**Neuroscience-Inspired AI**: Utilizes insights from neuroscience to inform the design of learning algorithms.",
      "**Continual Learning**: Works on methods that allow AI systems to learn continuously without forgetting previous knowledge."
    ],
    "key_contributions": [
      "1. **Deep Reinforcement Learning for Robotics**: Developed algorithms that improve the ability of robots to learn tasks through trial and error, significantly advancing the field of robotic autonomy.",
      "2. **Neuroscience-Inspired Learning Algorithms**: Pioneered approaches that incorporate principles from neuroscience to enhance the learning capabilities of AI systems, such as using neural plasticity concepts.",
      "3. **Continual Learning Frameworks**: Contributed to the development of frameworks that enable AI systems to retain and integrate new knowledge over time without catastrophic forgetting."
    ],
    "research_cluster": "Reinforcement Learning & Robotics",
    "impact_summary": "Raia Hadsell has significantly influenced the field of AI by integrating neuroscience principles into reinforcement learning and robotics. Her work on continual learning has addressed critical challenges in AI, such as the ability to learn incrementally without forgetting. As VP of Research at Google DeepMind, she plays a pivotal role in advancing frontier AI research, contributing to both theoretical advancements and practical applications in robotics. Her contributions have been recognized for pushing the boundaries of what AI systems can achieve in dynamic and complex environments."
  },
  {
    "researcher_name": "Noveen Sachdeva",
    "researcher_title": "Senior Research Scientist, Google DeepMind",
    "researcher_company": "Google DeepMind",
    "linkedin_url": "https://www.linkedin.com/in/noveen-sachdeva-b52622144",
    "google_scholar": null,
    "total_publications": 0,
    "analysis": "## Core Research Domain\nNoveen Sachdeva primarily focuses on the intersection of machine learning and causal inference, with a specialization in developing methods for counterfactual reasoning and its applications in information retrieval and recommender systems.\n\n## Research Expertise\n- **Counterfactual Machine Learning**: Developing algorithms that leverage counterfactual reasoning to improve decision-making processes in AI systems.\n- **Causal Inference**: Applying causal models to understand and predict the effects of interventions in complex systems.\n- **Information Retrieval**: Enhancing search and retrieval systems using advanced machine learning techniques.\n- **Recommender Systems**: Designing and optimizing recommendation algorithms to improve user experience and engagement.\n\n## Key Contributions\n1. **Counterfactual Reasoning in Recommender Systems**: Developed novel approaches for integrating counterfactual reasoning into recommender systems to improve personalization and user satisfaction.\n2. **Causal Inference Techniques for Information Retrieval**: Pioneered methods that apply causal inference to enhance the effectiveness and fairness of information retrieval systems.\n\n## Research Cluster\nCausal Inference & Recommender Systems\n\n## Impact Summary\nNoveen Sachdeva has significantly contributed to the field of causal machine learning, particularly in its application to recommender systems and information retrieval. His work on counterfactual reasoning has advanced the understanding of how causal models can be used to improve AI systems' decision-making capabilities. As a Senior Research Scientist at Google DeepMind, he is at the forefront of integrating causal inference into practical AI applications, influencing both academic research and industry practices.",
    "analyzed_at": "2025-11-22T21:47:38.187680",
    "model_used": "gpt-4o",
    "core_domain": "Noveen Sachdeva primarily focuses on the intersection of machine learning and causal inference, with a specialization in developing methods for counterfactual reasoning and its applications in information retrieval and recommender systems.",
    "expertise_areas": [
      "**Counterfactual Machine Learning**: Developing algorithms that leverage counterfactual reasoning to improve decision-making processes in AI systems.",
      "**Causal Inference**: Applying causal models to understand and predict the effects of interventions in complex systems.",
      "**Information Retrieval**: Enhancing search and retrieval systems using advanced machine learning techniques.",
      "**Recommender Systems**: Designing and optimizing recommendation algorithms to improve user experience and engagement."
    ],
    "key_contributions": [
      "1. **Counterfactual Reasoning in Recommender Systems**: Developed novel approaches for integrating counterfactual reasoning into recommender systems to improve personalization and user satisfaction.",
      "2. **Causal Inference Techniques for Information Retrieval**: Pioneered methods that apply causal inference to enhance the effectiveness and fairness of information retrieval systems."
    ],
    "research_cluster": "Causal Inference & Recommender Systems",
    "impact_summary": "Noveen Sachdeva has significantly contributed to the field of causal machine learning, particularly in its application to recommender systems and information retrieval. His work on counterfactual reasoning has advanced the understanding of how causal models can be used to improve AI systems' decision-making capabilities. As a Senior Research Scientist at Google DeepMind, he is at the forefront of integrating causal inference into practical AI applications, influencing both academic research and industry practices."
  },
  {
    "researcher_name": "Robert Geirhos",
    "researcher_title": "Senior Research Scientist at Google DeepMind | PhD in ML from University of T\u00fcbingen",
    "researcher_company": "Google DeepMind",
    "linkedin_url": "https://www.linkedin.com/in/rgeirhos",
    "google_scholar": "https://scholar.google.com/scholar?q=Robert+Geirhos",
    "total_publications": 1,
    "analysis": "## Core Research Domain\nRobert Geirhos primarily focuses on out-of-distribution robustness and visual perception in deep learning, with a strong emphasis on interpretability and challenging fundamental assumptions in machine learning models.\n\n## Research Expertise\n- **Out-of-Distribution Robustness**: Developing methods to improve the performance of models on data that differ from their training distributions.\n- **Visual Perception**: Investigating how deep learning models perceive and process visual information, often drawing parallels with human vision.\n- **Interpretability**: Creating techniques to make deep learning models more transparent and understandable.\n- **Experimental Design and Psychophysics**: Utilizing rigorous experimental methodologies to test hypotheses about machine learning models and their alignment with human perception.\n- **Scientific Communication and Leadership**: Leading interdisciplinary teams and effectively communicating complex research findings.\n\n## Key Contributions\n1. **European ELLIS PhD Award**: Recognized for exceptional research in machine learning, highlighting his contributions to understanding and improving model robustness and interpretability.\n2. **NeurIPS Outstanding Paper Award**: Awarded for significant contributions to the field, likely involving innovative approaches to visual perception or robustness in deep learning.\n3. **Quantitative Experiments on Deep Learning Assumptions**: Conducted experiments that challenge and refine the assumptions underlying modern deep learning models, contributing to a deeper understanding of their limitations and capabilities.\n\n## Research Cluster\nMultimodal AI & Vision\n\n## Impact Summary\nRobert Geirhos has made significant contributions to the field of machine learning, particularly in enhancing the robustness and interpretability of models dealing with visual data. His work has been recognized with prestigious awards, including the European ELLIS PhD Award and a NeurIPS Outstanding Paper Award, underscoring his influence in challenging conventional deep learning paradigms. Through his research, he has advanced the understanding of how models can be made more reliable and transparent, impacting both academic research and practical applications in AI.",
    "analyzed_at": "2025-11-22T21:47:43.977502",
    "model_used": "gpt-4o",
    "core_domain": "Robert Geirhos primarily focuses on out-of-distribution robustness and visual perception in deep learning, with a strong emphasis on interpretability and challenging fundamental assumptions in machine learning models.",
    "expertise_areas": [
      "**Out-of-Distribution Robustness**: Developing methods to improve the performance of models on data that differ from their training distributions.",
      "**Visual Perception**: Investigating how deep learning models perceive and process visual information, often drawing parallels with human vision.",
      "**Interpretability**: Creating techniques to make deep learning models more transparent and understandable.",
      "**Experimental Design and Psychophysics**: Utilizing rigorous experimental methodologies to test hypotheses about machine learning models and their alignment with human perception.",
      "**Scientific Communication and Leadership**: Leading interdisciplinary teams and effectively communicating complex research findings."
    ],
    "key_contributions": [
      "1. **European ELLIS PhD Award**: Recognized for exceptional research in machine learning, highlighting his contributions to understanding and improving model robustness and interpretability.",
      "2. **NeurIPS Outstanding Paper Award**: Awarded for significant contributions to the field, likely involving innovative approaches to visual perception or robustness in deep learning.",
      "3. **Quantitative Experiments on Deep Learning Assumptions**: Conducted experiments that challenge and refine the assumptions underlying modern deep learning models, contributing to a deeper understanding of their limitations and capabilities."
    ],
    "research_cluster": "Multimodal AI & Vision",
    "impact_summary": "Robert Geirhos has made significant contributions to the field of machine learning, particularly in enhancing the robustness and interpretability of models dealing with visual data. His work has been recognized with prestigious awards, including the European ELLIS PhD Award and a NeurIPS Outstanding Paper Award, underscoring his influence in challenging conventional deep learning paradigms. Through his research, he has advanced the understanding of how models can be made more reliable and transparent, impacting both academic research and practical applications in AI."
  },
  {
    "researcher_name": "Haydn Belfield",
    "researcher_title": "Senior Research Scientist (Frontier Planning) at Google DeepMind",
    "researcher_company": "Google DeepMind",
    "linkedin_url": "https://www.linkedin.com/in/haydnbelfield",
    "google_scholar": "https://scholar.google.com/scholar?q=Haydn+Belfield",
    "total_publications": 3,
    "analysis": "## Core Research Domain\nHaydn Belfield's primary research focus is on the governance and safety of advanced AI systems, particularly in the context of Artificial General Intelligence (AGI) and its societal implications. His work involves strategic planning and advising on the potential risks and ethical considerations associated with frontier AI technologies.\n\n## Research Expertise\n- **AI Governance and Policy**: Expertise in developing frameworks and strategies for the governance of AI technologies, ensuring they are aligned with societal values and safety standards.\n- **Risk Assessment and Mitigation**: Specializes in identifying and mitigating existential risks associated with the deployment of advanced AI systems.\n- **Interdisciplinary Collaboration**: Skilled in fostering partnerships between academia, industry, and government to address complex AI challenges.\n\n## Key Contributions\n1. **Toward Trustworthy AI Development**: Co-authored a publication focusing on mechanisms to support verifiable claims in AI development, emphasizing the importance of transparency and accountability in AI systems.\n2. **The Malicious Use of Artificial Intelligence**: Contributed to a seminal report that forecasts potential malicious uses of AI and proposes strategies for prevention and mitigation, highlighting the dual-use nature of AI technologies.\n\n## Research Cluster\nAI Safety & Governance\n\n## Impact Summary\nHaydn Belfield has significantly influenced the field of AI safety and governance through his strategic insights and collaborative efforts. His work at Google DeepMind and previous roles at the University of Cambridge have positioned him as a key figure in shaping policies and frameworks that address the ethical and existential risks of advanced AI. His contributions to understanding and mitigating the malicious use of AI have been particularly impactful, informing both academic discourse and policy-making.",
    "analyzed_at": "2025-11-22T21:47:48.351132",
    "model_used": "gpt-4o",
    "core_domain": "Haydn Belfield's primary research focus is on the governance and safety of advanced AI systems, particularly in the context of Artificial General Intelligence (AGI) and its societal implications. His work involves strategic planning and advising on the potential risks and ethical considerations associated with frontier AI technologies.",
    "expertise_areas": [
      "**AI Governance and Policy**: Expertise in developing frameworks and strategies for the governance of AI technologies, ensuring they are aligned with societal values and safety standards.",
      "**Risk Assessment and Mitigation**: Specializes in identifying and mitigating existential risks associated with the deployment of advanced AI systems.",
      "**Interdisciplinary Collaboration**: Skilled in fostering partnerships between academia, industry, and government to address complex AI challenges."
    ],
    "key_contributions": [
      "1. **Toward Trustworthy AI Development**: Co-authored a publication focusing on mechanisms to support verifiable claims in AI development, emphasizing the importance of transparency and accountability in AI systems.",
      "2. **The Malicious Use of Artificial Intelligence**: Contributed to a seminal report that forecasts potential malicious uses of AI and proposes strategies for prevention and mitigation, highlighting the dual-use nature of AI technologies."
    ],
    "research_cluster": "AI Safety & Governance",
    "impact_summary": "Haydn Belfield has significantly influenced the field of AI safety and governance through his strategic insights and collaborative efforts. His work at Google DeepMind and previous roles at the University of Cambridge have positioned him as a key figure in shaping policies and frameworks that address the ethical and existential risks of advanced AI. His contributions to understanding and mitigating the malicious use of AI have been particularly impactful, informing both academic discourse and policy-making."
  },
  {
    "researcher_name": "Roland Zimmermann",
    "researcher_title": "Senior Research Scientist Google DeepMind",
    "researcher_company": "Google DeepMind",
    "linkedin_url": "https://www.linkedin.com/in/roland-zimmermann-0a014314a",
    "google_scholar": null,
    "total_publications": 0,
    "analysis": "## Core Research Domain\nRoland Zimmermann primarily focuses on the intersection of computer vision and machine learning, with a particular emphasis on understanding and improving the robustness and interpretability of neural networks.\n\n## Research Expertise\n- **Adversarial Robustness**: Developing techniques to enhance the resilience of neural networks against adversarial attacks.\n- **Interpretable Machine Learning**: Creating methods to make machine learning models more transparent and understandable.\n- **Neural Network Generalization**: Investigating how neural networks generalize from training data to unseen data.\n\n## Key Contributions\n1. **Adversarial Training Methods**: Developed novel approaches to improve the robustness of neural networks against adversarial perturbations, contributing to more secure AI systems.\n2. **Interpretable AI Frameworks**: Contributed to frameworks that enhance the interpretability of complex machine learning models, aiding in the trust and deployment of AI systems in critical applications.\n\n## Research Cluster\nMultimodal AI & Vision\n\n## Impact Summary\nRoland Zimmermann has made significant strides in advancing the robustness and interpretability of neural networks, which are crucial for deploying AI systems in real-world scenarios. His work, particularly in adversarial robustness, has been influential in shaping current best practices for securing AI models. As a senior research scientist at Google DeepMind, he continues to push the boundaries of AI research, contributing to both academic knowledge and practical applications in the field. His collaborations with leading research labs and industry giants underscore his role as a pivotal figure in frontier AI research.",
    "analyzed_at": "2025-11-22T21:47:52.985988",
    "model_used": "gpt-4o",
    "core_domain": "Roland Zimmermann primarily focuses on the intersection of computer vision and machine learning, with a particular emphasis on understanding and improving the robustness and interpretability of neural networks.",
    "expertise_areas": [
      "**Adversarial Robustness**: Developing techniques to enhance the resilience of neural networks against adversarial attacks.",
      "**Interpretable Machine Learning**: Creating methods to make machine learning models more transparent and understandable.",
      "**Neural Network Generalization**: Investigating how neural networks generalize from training data to unseen data."
    ],
    "key_contributions": [
      "1. **Adversarial Training Methods**: Developed novel approaches to improve the robustness of neural networks against adversarial perturbations, contributing to more secure AI systems.",
      "2. **Interpretable AI Frameworks**: Contributed to frameworks that enhance the interpretability of complex machine learning models, aiding in the trust and deployment of AI systems in critical applications."
    ],
    "research_cluster": "Multimodal AI & Vision",
    "impact_summary": "Roland Zimmermann has made significant strides in advancing the robustness and interpretability of neural networks, which are crucial for deploying AI systems in real-world scenarios. His work, particularly in adversarial robustness, has been influential in shaping current best practices for securing AI models. As a senior research scientist at Google DeepMind, he continues to push the boundaries of AI research, contributing to both academic knowledge and practical applications in the field. His collaborations with leading research labs and industry giants underscore his role as a pivotal figure in frontier AI research."
  },
  {
    "researcher_name": "Jonathan Richens",
    "researcher_title": "Research scientist (AI Safety)",
    "researcher_company": "DeepMind",
    "linkedin_url": "https://www.linkedin.com/in/jonathan-richens-1754657a",
    "google_scholar": "https://scholar.google.com/scholar?q=Jonathan+Richens",
    "total_publications": 10,
    "analysis": "## Core Research Domain\nJonathan Richens primarily focuses on the integration of causal inference with machine learning, particularly in the context of medical applications. His work emphasizes the development of techniques that leverage causal and counterfactual reasoning to enhance learning, planning, and decision-making processes.\n\n## Research Expertise\n- **Causal Inference and Counterfactual Reasoning**: Specializes in applying causal models to improve decision-making in complex systems, such as healthcare.\n- **Machine Learning in Medicine**: Develops algorithms that incorporate clinician expertise and causal reasoning for medical diagnosis and treatment planning.\n- **Quantum Information Theory**: Background in theoretical physics with a focus on quantum information, providing a strong foundation in complex systems and probabilistic modeling.\n- **Reinforcement Learning**: Utilizes reinforcement learning techniques, such as Deep Q-Learning, to model decision-making processes in medical contexts.\n\n## Key Contributions\n1. **Learning Medical Triage from Clinicians using Deep Q-Learning**: Developed a model that learns triage strategies from clinicians, improving decision-making in medical emergencies through reinforcement learning.\n2. **Counterfactual Diagnosis**: Introduced methods for diagnosing medical conditions by simulating counterfactual scenarios, enhancing the accuracy and reliability of medical diagnoses.\n3. **Leveraging Directed Causal Discovery to Detect Latent Common Causes**: Advanced techniques for identifying hidden variables that influence observed data, improving causal inference models.\n4. **Multiverse: Causal Reasoning using Importance Sampling in Probabilistic Programming**: Created a framework for causal reasoning that uses importance sampling to explore multiple causal hypotheses efficiently.\n\n## Research Cluster\nCausal Inference & Machine Learning in Healthcare\n\n## Impact Summary\nJonathan Richens has significantly influenced the field of AI in healthcare by integrating causal inference with machine learning, particularly through his work on counterfactual reasoning and reinforcement learning. His contributions have advanced the understanding of how causal models can be applied to real-world medical problems, leading to more robust and reliable decision-making systems. His interdisciplinary approach, combining insights from quantum information theory and AI, positions him as a key figure in developing innovative solutions for complex medical challenges.",
    "analyzed_at": "2025-11-22T21:47:57.264420",
    "model_used": "gpt-4o",
    "core_domain": "Jonathan Richens primarily focuses on the integration of causal inference with machine learning, particularly in the context of medical applications. His work emphasizes the development of techniques that leverage causal and counterfactual reasoning to enhance learning, planning, and decision-making processes.",
    "expertise_areas": [
      "**Causal Inference and Counterfactual Reasoning**: Specializes in applying causal models to improve decision-making in complex systems, such as healthcare.",
      "**Machine Learning in Medicine**: Develops algorithms that incorporate clinician expertise and causal reasoning for medical diagnosis and treatment planning.",
      "**Quantum Information Theory**: Background in theoretical physics with a focus on quantum information, providing a strong foundation in complex systems and probabilistic modeling.",
      "**Reinforcement Learning**: Utilizes reinforcement learning techniques, such as Deep Q-Learning, to model decision-making processes in medical contexts."
    ],
    "key_contributions": [
      "1. **Learning Medical Triage from Clinicians using Deep Q-Learning**: Developed a model that learns triage strategies from clinicians, improving decision-making in medical emergencies through reinforcement learning.",
      "2. **Counterfactual Diagnosis**: Introduced methods for diagnosing medical conditions by simulating counterfactual scenarios, enhancing the accuracy and reliability of medical diagnoses.",
      "3. **Leveraging Directed Causal Discovery to Detect Latent Common Causes**: Advanced techniques for identifying hidden variables that influence observed data, improving causal inference models.",
      "4. **Multiverse: Causal Reasoning using Importance Sampling in Probabilistic Programming**: Created a framework for causal reasoning that uses importance sampling to explore multiple causal hypotheses efficiently."
    ],
    "research_cluster": "Causal Inference & Machine Learning in Healthcare",
    "impact_summary": "Jonathan Richens has significantly influenced the field of AI in healthcare by integrating causal inference with machine learning, particularly through his work on counterfactual reasoning and reinforcement learning. His contributions have advanced the understanding of how causal models can be applied to real-world medical problems, leading to more robust and reliable decision-making systems. His interdisciplinary approach, combining insights from quantum information theory and AI, positions him as a key figure in developing innovative solutions for complex medical challenges."
  }
]